mr,ref,alignment
"name[Rocket League], release_year[2015], developer[Psyonix], esrb[E (for Everyone)], genres[sport; vehicular combat], has_multiplayer[yes]",rocket league came out in 2015 by psyonix and is a sport game . the vehicular combat game can be played multiplayer and is rated e ( for everyone ) .,(0: name) (26: releaseyear) (34: developer) (51: genres) (103: hasmultiplayer) (123: esrb)
"name[Little Big Adventure], release_year[1994], rating[average], genres[action-adventure], platforms[PlayStation; PC], available_on_steam[yes], has_linux_release[no], has_mac_release[yes]","the 1994 action-adventure game , little big adventure , was released for playstation and pc . the game is on steam and has a mac release , but no linux release .",(4: releaseyear) (9: genres) (33: name) (73: platforms) (106: availableonsteam) (122: hasmacrelease) (142: haslinuxrelease)
"name[Little Big Adventure], release_year[1994], rating[average], genres[action-adventure], platforms[PlayStation; PC], available_on_steam[yes], has_linux_release[no], has_mac_release[yes]","little big adventure is an average action-adventure game for playstation , pc , and mac that was released in 1994 and is available on steam . currently , it is not available for linux .",(0: name) (27: rating) (35: genres) (61: platforms) (82: hasmacrelease) (109: releaseyear) (132: availableonsteam) (174: haslinuxrelease)
"name[Little Big Adventure], release_year[1994], rating[average], genres[action-adventure], platforms[PlayStation; PC], available_on_steam[yes], has_linux_release[no], has_mac_release[yes]","little big adventure is an average-rated 1994 action-adventure game . it 's available on playstation , pc , and mac , but not linux . you can buy it on steam .",(0: name) (27: rating) (41: releaseyear) (46: genres) (89: platforms) (109: hasmacrelease) (122: haslinuxrelease) (147: availableonsteam)
"name[Tetris], genres[arcade; puzzle; strategy], player_perspective[side view]",tetris is a side view arcade puzzle and strategy game .,(0: name) (12: playerperspective) (22: genres)
"name[Tetris], genres[arcade; puzzle; strategy], player_perspective[side view]",tetris is a side view strategic puzzle arcade game .,(0: name) (12: playerperspective) (22: genres)
"name[Tetris], genres[arcade; puzzle; strategy], player_perspective[side view]",tetris is a side view puzzle-strategy arcade game .,(0: name) (12: playerperspective) (22: genres)
"name[TrackMania Turbo], release_year[2016], developer[Nadeo], rating[good], genres[arcade; driving/racing], player_perspective[first person; third person]",trackmania turbo by nadeo is a good arcade driving/racing game from 2016. it is played in the first person and third person point of view .,(0: name) (20: developer) (31: rating) (36: genres) (68: releaseyear) (94: playerperspective)
"name[TrackMania Turbo], release_year[2016], developer[Nadeo], rating[good], genres[arcade; driving/racing], player_perspective[first person; third person]",trackmania turbo is a fun game that came out in 2016. it was made by nadeo and is a driving/racing arcade style of game . you can view the race in first person or third person .,(0: name) (22: rating) (48: releaseyear) (69: developer) (84: genres) (147: playerperspective)
"name[TrackMania Turbo], release_year[2016], developer[Nadeo], rating[good], genres[arcade; driving/racing], player_perspective[first person; third person]",trackmania turbo is a good first person or third person driving/racing game with arcade elements . it was developed by nadeo in 2016 .,(0: name) (22: rating) (27: playerperspective) (56: genres) (119: developer) (128: releaseyear)
"name[Guitar Hero: Smash Hits], release_year[2009], esrb[T (for Teen)], genres[music]","if you like music games geared toward a t ( for teen ) -rated audience , you should check out the 2009-released game known as guitar hero : smash hits .",(12: genres) (48: esrb) (97: releaseyear) (125: name)
"name[Guitar Hero: Smash Hits], release_year[2009], esrb[T (for Teen)], genres[music]","i enjoy guitar hero : smash hits , the music game from 2009. it 's rated t for teen .",(8: name) (39: genres) (55: releaseyear) (66: esrb)
"name[Guitar Hero: Smash Hits], release_year[2009], esrb[T (for Teen)], genres[music]",guitar hero : smash hits is a music game released in 2009. it is rated t ( for teen ) .,(0: name) (30: genres) (53: releaseyear) (65: esrb)
"name[Uncharted 4: A Thief's End], release_year[2016], rating[excellent], genres[action-adventure; shooter], player_perspective[third person], platforms[PlayStation]","if you have a playstation , i have an action-adventure third person shooter that you can not pass up . with its excellent rating , uncharted 4 : a thief 's end is a must-play-now if you have n't played it since it was released in 2016 .",(14: platforms) (38: genres) (55: playerperspective) (112: rating) (131: name) (230: releaseyear)
"name[Uncharted 4: A Thief's End], release_year[2016], rating[excellent], genres[action-adventure; shooter], player_perspective[third person], platforms[PlayStation]","if you like action-adventure third person shooter games , then you should try the video game released in 2016 called uncharted 4 : a thief 's end . it has an excellent rating but is released only on the playstation .",(12: genres) (29: playerperspective) (105: releaseyear) (117: name) (157: rating) (203: platforms)
"name[Uncharted 4: A Thief's End], release_year[2016], rating[excellent], genres[action-adventure; shooter], player_perspective[third person], platforms[PlayStation]",an excellent third person shooter for playstation is a game called uncharted 4 : a thief 's end . this action-adventure game actually came out in 2016 .,(3: rating) (13: playerperspective) (26: genres) (38: platforms) (67: name) (146: releaseyear)
"name[Portal 2], release_year[2011], esrb[E 10+ (for Everyone 10 and Older)], rating[excellent], genres[platformer; puzzle; shooter], player_perspective[first person]","portal 2 is a first person platformer with shooter and puzzle elements . it was released in 2011 and received a esrb rating of e 10+ ( for everyone 10 and older ) . overall , the game received excellent ratings .",(0: name) (14: playerperspective) (27: genres) (92: releaseyear) (127: esrb) (193: rating)
"name[Portal 2], release_year[2011], esrb[E 10+ (for Everyone 10 and Older)], rating[excellent], genres[platformer; puzzle; shooter], player_perspective[first person]","portal 2 , released in 2011 , is an excellent first person platformer , puzzle , and shooter game . it is rated e 10+ ( for everyone 10 and older ) .",(0: name) (23: releaseyear) (36: rating) (46: playerperspective) (59: genres) (112: esrb)
"name[Portal 2], release_year[2011], esrb[E 10+ (for Everyone 10 and Older)], rating[excellent], genres[platformer; puzzle; shooter], player_perspective[first person]",portal 2 is an excellent puzzle platformer and first person shooter . it is rated e 10+ ( for everyone 10 and older ) and was released in 2011 .,(0: name) (15: rating) (25: genres) (47: playerperspective) (82: esrb) (138: releaseyear)
"name[Undertale], release_year[2015], genres[adventure; indie; role-playing], player_perspective[bird view]","if you like indie role-playing adventures , check out undertale , released in 2015. in the game , the player has a bird view perspective .",(12: genres) (54: name) (78: releaseyear) (111: playerperspective)
"name[Undertale], release_year[2015], genres[adventure; indie; role-playing], player_perspective[bird view]","undertale is an indie adventure , role-playing game that is set in bird view perspective . it was released in 2015 .",(0: name) (16: genres) (66: playerperspective) (110: releaseyear)
"name[Undertale], release_year[2015], genres[adventure; indie; role-playing], player_perspective[bird view]",undertale was released in 2015. it is an indie adventure role-playing game that is played from a bird view perspective .,(0: name) (26: releaseyear) (41: genres) (96: playerperspective)
"name[A Way Out], rating[good], genres[action-adventure], player_perspective[third person], platforms[PlayStation; Xbox; PC], available_on_steam[no]","a way out is a good third person action-adventure game available on playstation , xbox , and pc . it 's not available on steam .",(0: name) (15: rating) (20: playerperspective) (33: genres) (68: platforms) (118: availableonsteam)
"name[A Way Out], rating[good], genres[action-adventure], player_perspective[third person], platforms[PlayStation; Xbox; PC], available_on_steam[no]","a way out is a good third person action-adventure game . it runs on playstation , xbox , and pc , but it is not on steam .",(0: name) (15: rating) (20: playerperspective) (33: genres) (68: platforms) (111: availableonsteam)
"name[A Way Out], rating[good], genres[action-adventure], player_perspective[third person], platforms[PlayStation; Xbox; PC], available_on_steam[no]","a way out is a good action-adventure game played in third person . it is playable on playstation , xbox and pc but does not have a steam release .",(0: name) (15: rating) (20: genres) (52: playerperspective) (85: platforms) (129: availableonsteam)
"name[Alan Wake's American Nightmare], release_year[2012], rating[poor], genres[action-adventure; shooter], player_perspective[third person], platforms[Xbox; PC], has_linux_release[no], has_mac_release[no]","if you are interested in third person action-adventure shooters for xbox or pc , check out alan wake 's american nightmare . it was released in 2012 and has garnered poor reviews . it is not available for mac or linux .",(25: playerperspective) (38: genres) (68: platforms) (91: name) (144: releaseyear) (164: rating) (202: hasmacrelease) (209: haslinuxrelease)
"name[Alan Wake's American Nightmare], release_year[2012], rating[poor], genres[action-adventure; shooter], player_perspective[third person], platforms[Xbox; PC], has_linux_release[no], has_mac_release[no]","alan wake 's american nightmare is a poor action-adventure third person shooter . it was released in 2012 for xbox and pc , with no linux or mac versions .",(0: name) (37: rating) (42: genres) (59: playerperspective) (101: releaseyear) (109: platforms) (130: haslinuxrelease) (139: hasmacrelease)
"name[Alan Wake's American Nightmare], release_year[2012], rating[poor], genres[action-adventure; shooter], player_perspective[third person], platforms[Xbox; PC], has_linux_release[no], has_mac_release[no]",alan wake 's american nightmare is a poor action-adventure third person shooter that came out in 2012 for xbox and pc only . it is not available on linux or mac .,(0: name) (37: rating) (42: genres) (59: playerperspective) (97: releaseyear) (106: platforms) (147: haslinuxrelease) (156: hasmacrelease)
"name[Mafia], release_year[2002], genres[driving/racing; fighting; shooter], has_multiplayer[no]","mafia is a single-player driving/racing , fighting shooter game from 2002 .",(0: name) (11: hasmultiplayer) (25: genres) (69: releaseyear)
"name[Mafia], release_year[2002], genres[driving/racing; fighting; shooter], has_multiplayer[no]",mafia is a 2002 single-player shooter game filled with driving and fighting .,(0: name) (11: releaseyear) (16: hasmultiplayer) (30: genres)
"name[Mafia], release_year[2002], genres[driving/racing; fighting; shooter], has_multiplayer[no]","if you 're looking for a single-player game with driving , fighting and shooting , mafia , from 2002 , is for you .",(24: hasmultiplayer) (49: genres) (83: name) (96: releaseyear)
"name[Assassin's Creed II], rating[good], genres[action-adventure; platformer], player_perspective[third person]","for an action-adventure and platformer game title that has good ratings with a third person perspective , check out assassin 's creed ii .",(7: genres) (59: rating) (79: playerperspective) (116: name)
"name[Assassin's Creed II], rating[good], genres[action-adventure; platformer], player_perspective[third person]",assassin 's creed ii is a good action-adventure platformer with a third person perspective .,(0: name) (26: rating) (31: genres) (66: playerperspective)
"name[Assassin's Creed II], rating[good], genres[action-adventure; platformer], player_perspective[third person]",assassin 's creed ii is a good third person action-adventure platformer .,(0: name) (26: rating) (31: playerperspective) (44: genres)
"name[Warcraft III: Reign of Chaos], release_year[2002], developer[Blizzard Entertainment], rating[excellent], genres[real-time strategy], player_perspective[bird view], has_multiplayer[yes]","warcraft iii : reign of chaos was developed by blizzard entertainment , and was released in 2002. it is an excellent real-time strategy game that is played from a bird view . it can be played in a multiplayer mode .",(0: name) (47: developer) (92: releaseyear) (107: rating) (117: genres) (161: playerperspective) (194: hasmultiplayer)
"name[Warcraft III: Reign of Chaos], release_year[2002], developer[Blizzard Entertainment], rating[excellent], genres[real-time strategy], player_perspective[bird view], has_multiplayer[yes]",warcraft iii : reign of chaos is a real-time strategy multiplayer game that was released in 2002 by blizzard entertainment . it has a bird 's eye view and received excellent reviews .,(0: name) (35: genres) (54: hasmultiplayer) (92: releaseyear) (100: developer) (133: playerperspective) (163: rating)
"name[Warcraft III: Reign of Chaos], release_year[2002], developer[Blizzard Entertainment], rating[excellent], genres[real-time strategy], player_perspective[bird view], has_multiplayer[yes]",warcraft iii : reign of chaos is an excellent real-time strategy game that was released in 2002 by blizzard entertainment . it is a bird view perspective multiplayer game .,(0: name) (36: rating) (46: genres) (91: releaseyear) (99: developer) (131: playerperspective) (153: hasmultiplayer)
"name[Age of Empires II: The Age of Kings], developer[Ensemble Studios], esrb[T (for Teen)], rating[good], genres[real-time strategy], player_perspective[bird view]",age of empires ii : the age of kings is a fun real-time strategy game developed by ensemble studios . the bird view game is rated t ( for teen ) and was received well by critics .,(0: name) (42: rating) (46: genres) (83: developer) (105: playerperspective) (124: esrb)
"name[Age of Empires II: The Age of Kings], developer[Ensemble Studios], esrb[T (for Teen)], rating[good], genres[real-time strategy], player_perspective[bird view]",real-time strategy enthusiasts will love age of empires ii : the age of kings by ensemble studios . the game is rated t ( for teen ) with a good rating . there is a bird view perspective in this game .,(0: genres) (41: name) (81: developer) (112: esrb) (139: rating) (163: playerperspective)
"name[Age of Empires II: The Age of Kings], developer[Ensemble Studios], esrb[T (for Teen)], rating[good], genres[real-time strategy], player_perspective[bird view]","age of empires ii : the age of kings is a good real-time strategy game that has a bird view . ensemble studios developed it , and it is rated t ( for teen ) .",(0: name) (42: rating) (47: genres) (82: playerperspective) (94: developer) (136: esrb)
"name[God of War], release_year[2018], rating[excellent], genres[action-adventure; platformer; role-playing], player_perspective[third person], has_multiplayer[no], platforms[PlayStation]","the 2018 playstation exclusive game , god of war , has gotten excellent ratings . the single-player game is popular for its adventure-filled action , platforming , and role-playing capabilities . the players play from a third person perspective .",(4: releaseyear) (9: platforms) (38: name) (62: rating) (86: hasmultiplayer) (124: genres) (220: playerperspective)
"name[God of War], release_year[2018], rating[excellent], genres[action-adventure; platformer; role-playing], player_perspective[third person], has_multiplayer[no], platforms[PlayStation]","god of war is a role-playing , action-adventure , platformer released in 2018 for playstation . the game received an excellent rating . even though it 's not multiplayer , you get to play in the third person perspective .",(0: name) (16: genres) (73: releaseyear) (82: platforms) (117: rating) (154: hasmultiplayer) (195: playerperspective)
"name[God of War], release_year[2018], rating[excellent], genres[action-adventure; platformer; role-playing], player_perspective[third person], has_multiplayer[no], platforms[PlayStation]","god of war was released in 2018 for playstation . it 's an excellent action-adventure , platformer , role-playing game that is played in third person . there is no multiplayer mode .",(0: name) (27: releaseyear) (36: platforms) (58: rating) (69: genres) (137: playerperspective) (160: hasmultiplayer)
"name[Rollcage], release_year[1999], genres[action; driving/racing], platforms[PlayStation; PC], has_linux_release[no], has_mac_release[no]","if you like action games , rollcage is a driving/racing game from 1999. it runs on playstation and pc . however , it is not supported on linux or mac .",(12: genres) (27: name) (66: releaseyear) (83: platforms) (133: haslinuxrelease) (142: hasmacrelease)
"name[Rollcage], release_year[1999], genres[action; driving/racing], platforms[PlayStation; PC], has_linux_release[no], has_mac_release[no]","if you enjoy driving and racing , try rollcage . it 's an action game released in 1999 for playstation and pc . it does n't have a linux or mac release .",(13: genres) (38: name) (82: releaseyear) (91: platforms) (128: haslinuxrelease) (137: hasmacrelease)
"name[Rollcage], release_year[1999], genres[action; driving/racing], platforms[PlayStation; PC], has_linux_release[no], has_mac_release[no]","rollcage is a 1999 driving/racing game released for playstation and pc . offering non-stop action , rollcage is currently available for windows with no release for linux or mac .",(0: name) (14: releaseyear) (19: genres) (52: platforms) (162: haslinuxrelease) (171: hasmacrelease)
"name[Crysis], release_year[2007], genres[action-adventure; shooter], player_perspective[first person], platforms[PlayStation; Xbox; PC], available_on_steam[yes], has_linux_release[no], has_mac_release[no]","crysis is a 2007 action-adventure , first person shooter on playstation , xbox , pc , and steam . it 's currently not supported on linux or mac .",(0: name) (12: releaseyear) (17: genres) (36: playerperspective) (60: platforms) (86: availableonsteam) (126: haslinuxrelease) (135: hasmacrelease)
"name[Crysis], release_year[2007], genres[action-adventure; shooter], player_perspective[first person], platforms[PlayStation; Xbox; PC], available_on_steam[yes], has_linux_release[no], has_mac_release[no]","crysis was released in 2007. it 's a first person action-adventure shooter game . you can get it for playstation , xbox , and pc , and it 's also available on steam .",(0: name) (23: releaseyear) (37: playerperspective) (50: genres) (101: platforms) (154: availableonsteam)
"name[Crysis], release_year[2007], genres[action-adventure; shooter], player_perspective[first person], platforms[PlayStation; Xbox; PC], available_on_steam[yes], has_linux_release[no], has_mac_release[no]","crysis is an action-adventure first person shooter that was released in 2007 for playstation , xbox , and pc . it 's available on steam , but it does n't have a mac or linux release .",(0: name) (13: genres) (30: playerperspective) (72: releaseyear) (81: platforms) (127: availableonsteam) (157: hasmacrelease) (164: haslinuxrelease)
"name[Diablo II], release_year[2000], rating[good], genres[hack-and-slash; role-playing], has_multiplayer[yes], platforms[PC], has_linux_release[no], has_mac_release[yes]",diablo ii is a good hack-and-slash role-playing game with multiplayer availability . it was released for pc in 2000. it is available for mac but not for linux .,(0: name) (15: rating) (20: genres) (58: hasmultiplayer) (104: platforms) (111: releaseyear) (135: hasmacrelease) (151: haslinuxrelease)
"name[Diablo II], release_year[2000], rating[good], genres[hack-and-slash; role-playing], has_multiplayer[yes], platforms[PC], has_linux_release[no], has_mac_release[yes]","a good hack-and-slash , role-playing game is diablo ii released in 2000. it has a multiplayer mode . it came out on pc and mac but not on linux .",(2: rating) (7: genres) (45: name) (67: releaseyear) (80: hasmultiplayer) (113: platforms) (120: hasmacrelease) (135: haslinuxrelease)
"name[Diablo II], release_year[2000], rating[good], genres[hack-and-slash; role-playing], has_multiplayer[yes], platforms[PC], has_linux_release[no], has_mac_release[yes]",diablo ii is a good hack-and-slash rpg from 2000. it is a multiplayer game . it is available for pc and mac but not linux .,(0: name) (15: rating) (20: genres) (44: releaseyear) (57: hasmultiplayer) (95: platforms) (102: hasmacrelease) (114: haslinuxrelease)
"name[World of Warcraft], release_year[2004], developer[Blizzard Entertainment], genres[adventure; MMORPG]",world of warcraft was released by blizzard entertainment in 2004. it 's an adventure mmorpg .,(0: name) (34: developer) (60: releaseyear) (75: genres)
"name[World of Warcraft], release_year[2004], developer[Blizzard Entertainment], genres[adventure; MMORPG]",world of warcraft is an mmorpg adventure game that was released in 2004 by blizzard entertainment .,(0: name) (24: genres) (67: releaseyear) (75: developer)
"name[World of Warcraft], release_year[2004], developer[Blizzard Entertainment], genres[adventure; MMORPG]",world of warcraft is an adventure mmorpg game that came out in 2004 by blizzard entertainment .,(0: name) (24: genres) (63: releaseyear) (71: developer)
"name[Undertale], release_year[2015], rating[excellent], genres[adventure; indie; role-playing], has_multiplayer[no], platforms[PlayStation; Nintendo Switch; PC], has_linux_release[yes], has_mac_release[yes]","undertale from 2015 is an excellent indie adventure role-playing game , but it does n't have multiplayer . it can be played on playstation , nintendo switch , pc , linux , or mac .",(0: name) (15: releaseyear) (26: rating) (36: genres) (92: hasmultiplayer) (127: platforms) (159: haslinuxrelease) (169: hasmacrelease)
"name[Undertale], release_year[2015], rating[excellent], genres[adventure; indie; role-playing], has_multiplayer[no], platforms[PlayStation; Nintendo Switch; PC], has_linux_release[yes], has_mac_release[yes]","if you want an excellent adventure game , try undertale . it came out in 2015 on playstation , nintendo switch , and pc . it is an indie role-playing game with no multiplayer option . undertale is also available on linux and mac .",(15: rating) (25: genres) (46: name) (73: releaseyear) (81: platforms) (158: hasmultiplayer) (209: haslinuxrelease) (219: hasmacrelease)
"name[Undertale], release_year[2015], rating[excellent], genres[adventure; indie; role-playing], has_multiplayer[no], platforms[PlayStation; Nintendo Switch; PC], has_linux_release[yes], has_mac_release[yes]","if you love adventure and role-playing games , try undertale , although keep in mind that it 's single-player only . it 's an excellent indie game from 2015 released for playstation , nintendo switch , and pc . you can even play it on linux or mac .",(12: genres) (51: name) (95: hasmultiplayer) (124: rating) (152: releaseyear) (170: platforms) (229: haslinuxrelease) (238: hasmacrelease)
"name[Assassin's Creed II], release_year[2009], rating[good], genres[action-adventure; platformer], platforms[PlayStation; Xbox; PC], available_on_steam[yes], has_linux_release[no], has_mac_release[yes]","assassin 's creed ii is considered a good action-adventure platformer . it was released in 2009 for playstation , xbox , and pc and is available on steam and mac but currently not linux .",(0: name) (37: rating) (42: genres) (91: releaseyear) (100: platforms) (145: availableonsteam) (155: hasmacrelease) (177: haslinuxrelease)
"name[Assassin's Creed II], release_year[2009], rating[good], genres[action-adventure; platformer], platforms[PlayStation; Xbox; PC], available_on_steam[yes], has_linux_release[no], has_mac_release[yes]","assassin 's creed ii is a 2009 action-adventure , platformer game with good ratings . it 's available on playstation , xbox , pc and mac , but not linux . you can get it on steam .",(0: name) (26: releaseyear) (31: genres) (70: rating) (105: platforms) (129: hasmacrelease) (142: haslinuxrelease) (167: availableonsteam)
"name[Assassin's Creed II], release_year[2009], rating[good], genres[action-adventure; platformer], platforms[PlayStation; Xbox; PC], available_on_steam[yes], has_linux_release[no], has_mac_release[yes]","assassin 's creed ii is a 2009 action-adventure platformer game available on playstation , xbox , and pc . it is on steam and has mac support , but does not run on linux . the game is really fun .",(0: name) (26: releaseyear) (31: genres) (77: platforms) (113: availableonsteam) (127: hasmacrelease) (160: haslinuxrelease) (186: rating)
"name[Assassin's Creed II], developer[Ubisoft Montreal], genres[action-adventure; platformer], player_perspective[third person]",assassin 's creed ii is a third person action-adventure platformer developed by ubisoft montreal .,(0: name) (26: playerperspective) (39: genres) (80: developer)
"name[Assassin's Creed II], developer[Ubisoft Montreal], genres[action-adventure; platformer], player_perspective[third person]",assassin 's creed ii was developed by ubisoft montreal and is a third person action-adventure platformer .,(0: name) (38: developer) (64: playerperspective) (77: genres)
"name[Assassin's Creed II], developer[Ubisoft Montreal], genres[action-adventure; platformer], player_perspective[third person]",assassin 's creed ii is an action-adventure platformer that was released by ubisoft montreal . it is played in the third person .,(0: name) (27: genres) (76: developer) (115: playerperspective)
