mr,ref,alignment
"name[Final Fantasy VII], rating[excellent], genres[adventure; role-playing], player_perspective[bird view; third person]",the excellent final fantasy vii is a third person role-playing adventure game that also allows you to switch to a bird view perspective .,(4: rating) (14: name) (37: playerperspective) (50: genres)
"name[Final Fantasy VII], rating[excellent], genres[adventure; role-playing], player_perspective[bird view; third person]",final fantasy vii is an excellent adventure role-playing game that can be played either in bird view or third person view .,(0: name) (24: rating) (34: genres) (91: playerperspective)
"name[Final Fantasy VII], rating[excellent], genres[adventure; role-playing], player_perspective[bird view; third person]",final fantasy vii is a bird view and third person adventure role-playing game . it has excellent ratings .,(0: name) (23: playerperspective) (50: genres) (87: rating)
"name[Might & Magic: Heroes VI], release_year[2011], genres[role-playing; turn-based strategy], platforms[PC], available_on_steam[yes], has_linux_release[no], has_mac_release[no]",might & magic : heroes vi is a 2011 role-playing turn-based strategy pc game and is available on steam but not linux or mac .,(0: name) (31: releaseyear) (36: genres) (69: platforms) (97: availableonsteam) (111: haslinuxrelease) (120: hasmacrelease)
"name[Might & Magic: Heroes VI], release_year[2011], genres[role-playing; turn-based strategy], platforms[PC], available_on_steam[yes], has_linux_release[no], has_mac_release[no]","might & magic : heroes vi from 2011 is a role-playing turn-based strategy . it is available on steam , and is supported on the pc platform . however , it is not released on mac or linux .",(0: name) (31: releaseyear) (41: genres) (94: availableonsteam) (125: platforms) (169: hasmacrelease) (176: haslinuxrelease)
"name[Might & Magic: Heroes VI], release_year[2011], genres[role-playing; turn-based strategy], platforms[PC], available_on_steam[yes], has_linux_release[no], has_mac_release[no]","might & magic : heroes vi came out in 2011 and is a role-playing turn-based strategy for pc only . the game is available on steam , but not for linux or mac .",(0: name) (38: releaseyear) (52: genres) (89: platforms) (123: availableonsteam) (142: haslinuxrelease) (151: hasmacrelease)
"name[Little Big Adventure], genres[action-adventure], player_perspective[third person]",little big adventure is a third person action game loaded with tons of adventure .,(0: name) (11: genres) (26: playerperspective)
"name[Little Big Adventure], genres[action-adventure], player_perspective[third person]",little big adventure is a third person action-adventure game .,(0: name) (26: playerperspective) (39: genres)
"name[Little Big Adventure], genres[action-adventure], player_perspective[third person]",little big adventure is a third person action-adventure game .,(0: name) (26: playerperspective) (39: genres)
"name[Need for Speed: The Run], release_year[2011], esrb[T (for Teen)], genres[driving/racing]",need for speed : the run is a racing game rated t ( for teen ) . it was released in 2011 .,(0: name) (30: genres) (42: esrb) (84: releaseyear)
"name[Need for Speed: The Run], release_year[2011], esrb[T (for Teen)], genres[driving/racing]",need for speed : the run is a 2011 racing game that is rated t for teen audiences .,(0: name) (30: releaseyear) (35: genres) (55: esrb)
"name[Need for Speed: The Run], release_year[2011], esrb[T (for Teen)], genres[driving/racing]","need for speed : the run is a driving/racing game that 's been around since 2011. it is even fairly family-friendly , since it is rated t ( for teen ) .",(0: name) (30: genres) (76: releaseyear) (129: esrb)
"name[Rocket League], genres[sport; vehicular combat], player_perspective[third person], platforms[PlayStation; Xbox; Nintendo Switch; PC], has_linux_release[yes], has_mac_release[yes]","rocket league is a third person vehicular combat sports game released for playstation , xbox , nintendo switch , pc , linux , and mac .",(0: name) (19: playerperspective) (32: genres) (74: platforms) (114: haslinuxrelease) (125: hasmacrelease)
"name[Rocket League], genres[sport; vehicular combat], player_perspective[third person], platforms[PlayStation; Xbox; Nintendo Switch; PC], has_linux_release[yes], has_mac_release[yes]","rocket league is a third person sports and vehicular combat game available for playstation , xbox , nintendo switch , and pc . it has no linux or mac release .",(0: name) (19: playerperspective) (32: genres) (79: platforms)
"name[Rocket League], genres[sport; vehicular combat], player_perspective[third person], platforms[PlayStation; Xbox; Nintendo Switch; PC], has_linux_release[yes], has_mac_release[yes]","rocket league is a third person vehicular combat sports game . it is out for playstation , xbox , nintendo switch , pc , linux , and mac .",(0: name) (19: playerperspective) (32: genres) (77: platforms) (116: haslinuxrelease) (127: hasmacrelease)
"name[MotorStorm: Apocalypse], genres[vehicular combat], platforms[PlayStation]",motorstorm : apocalypse is a vehicular combat game for playstation only .,(0: name) (29: genres) (55: platforms)
"name[MotorStorm: Apocalypse], genres[vehicular combat], platforms[PlayStation]",motorstorm : apocalypse is a vehicular combat game exclusively for playstation .,(0: name) (29: genres) (67: platforms)
"name[MotorStorm: Apocalypse], genres[vehicular combat], platforms[PlayStation]",try motorstorm : apocalypse for playstation if you enjoy vehicular combat games .,(4: name) (32: platforms) (57: genres)
"name[StarCraft], rating[good], genres[real-time strategy], platforms[PC], available_on_steam[no], has_linux_release[no], has_mac_release[yes]",starcraft is a good real-time strategy game for pc . it is available for mac but not for linux . it is unavailable on steam .,(0: name) (15: rating) (20: genres) (48: platforms) (72: hasmacrelease) (88: haslinuxrelease) (116: availableonsteam)
"name[StarCraft], rating[good], genres[real-time strategy], platforms[PC], available_on_steam[no], has_linux_release[no], has_mac_release[yes]","starcraft is a pc-only real-time strategy game that is a good . you can get this game on steam and also play it on mac , but not on linux .",(0: name) (15: platforms) (23: genres) (57: rating) (88: availableonsteam) (114: hasmacrelease) (130: haslinuxrelease)
"name[StarCraft], rating[good], genres[real-time strategy], platforms[PC], available_on_steam[no], has_linux_release[no], has_mac_release[yes]",starcraft is a good real-time strategy pc game that is also available on mac . it is not currently available on steam or linux .,(0: name) (15: rating) (20: genres) (39: platforms) (73: hasmacrelease) (111: availableonsteam) (120: haslinuxrelease)
"name[Alan Wake's American Nightmare], rating[poor], genres[action-adventure; shooter], has_multiplayer[no]",alan wake 's american nightmare is a poor action-adventure shooter without multiplayer .,(0: name) (37: rating) (42: genres) (75: hasmultiplayer)
"name[Alan Wake's American Nightmare], rating[poor], genres[action-adventure; shooter], has_multiplayer[no]","alan wake 's american nightmare is a poorly-rated action-adventure shooter game . it has no multiplayer , limiting the enjoyability of the game .",(0: name) (36: rating) (50: genres) (91: hasmultiplayer)
"name[Alan Wake's American Nightmare], rating[poor], genres[action-adventure; shooter], has_multiplayer[no]","alan wake 's american nightmare is a single-player action-adventure shooter , and it has poor ratings .",(0: name) (36: hasmultiplayer) (51: genres) (88: rating)
"name[Uncharted 4: A Thief's End], release_year[2016], rating[excellent], genres[action-adventure; shooter], platforms[PlayStation]",uncharted 4 : a thief 's end from 2016 is an excellent action-adventure shooter for the playstation .,(0: name) (34: releaseyear) (44: rating) (55: genres) (88: platforms)
"name[Uncharted 4: A Thief's End], release_year[2016], rating[excellent], genres[action-adventure; shooter], platforms[PlayStation]",uncharted 4 : a thief 's end is a fantastic action-adventure shooter from 2016. it 's a playstation exclusive .,(0: name) (33: rating) (44: genres) (74: releaseyear) (88: platforms)
"name[Uncharted 4: A Thief's End], release_year[2016], rating[excellent], genres[action-adventure; shooter], platforms[PlayStation]",uncharted 4 : a thief 's end is an excellent action-adventure shooter . it was out for playstation in 2016 .,(0: name) (34: rating) (45: genres) (87: platforms) (102: releaseyear)
"name[Mirror's Edge Catalyst], developer[EA Digital Illusions CE], genres[action-adventure; fighting]",mirror 's edge catalyst is an action-adventure fighting game by ea digital illusions ce .,(0: name) (30: genres) (64: developer)
"name[Mirror's Edge Catalyst], developer[EA Digital Illusions CE], genres[action-adventure; fighting]","mirror 's edge catalyst by ea digital illusions ce is an action-adventure , fighting game .",(0: name) (27: developer) (57: genres)
"name[Mirror's Edge Catalyst], developer[EA Digital Illusions CE], genres[action-adventure; fighting]","mirror 's edge catalyst is an action-packed adventure game with some fighting , released by ea digital illusions ce .",(0: name) (30: genres) (92: developer)
"name[BioShock], release_year[2007], rating[good], genres[action-adventure; role-playing; shooter], player_perspective[first person], has_multiplayer[no]",bioshock is a first person action-adventure role-playing shooter that released in 2007. the game received good ratings from players despite its lack of multiplayer .,(0: name) (14: playerperspective) (27: genres) (82: releaseyear) (105: rating) (151: hasmultiplayer)
"name[BioShock], release_year[2007], rating[good], genres[action-adventure; role-playing; shooter], player_perspective[first person], has_multiplayer[no]","bioshock is a good action-adventure first person shooter with role-playing , released in 2007. the game does not feature multiplayer .",(0: name) (14: rating) (19: genres) (36: playerperspective) (89: releaseyear) (119: hasmultiplayer)
"name[BioShock], release_year[2007], rating[good], genres[action-adventure; role-playing; shooter], player_perspective[first person], has_multiplayer[no]","bioshock , released in 2007 , is a good action-adventure role-playing shooter played in first person . it is not a multiplayer game .",(0: name) (23: releaseyear) (33: rating) (40: genres) (88: playerperspective) (112: hasmultiplayer)
"name[Might & Magic: Heroes VI], rating[average], genres[role-playing; turn-based strategy], platforms[PC], available_on_steam[yes], has_linux_release[no], has_mac_release[no]","might & magic : heroes vi was a decent role-playing turn-based strategy game for the pc . you can get it on steam , but you ca n't play on linux or mac .",(0: name) (32: rating) (39: genres) (85: platforms) (107: availableonsteam) (137: haslinuxrelease) (146: hasmacrelease)
"name[Might & Magic: Heroes VI], rating[average], genres[role-playing; turn-based strategy], platforms[PC], available_on_steam[yes], has_linux_release[no], has_mac_release[no]","if you 're into pc role-playing games with turn-based strategy , look no further than might & magic : heroes vi . although this particular title is n't available on linux or mac , you can find it at the steam store . people consider this game average , and it has received ratings that reflect that .",(16: platforms) (19: genres) (86: name) (163: haslinuxrelease) (172: hasmacrelease) (200: availableonsteam) (241: rating)
"name[Might & Magic: Heroes VI], rating[average], genres[role-playing; turn-based strategy], platforms[PC], available_on_steam[yes], has_linux_release[no], has_mac_release[no]",might & magic : heroes vi is an average turn-based strategy role-playing game for pc and steam . there is no linux or mac release .,(0: name) (32: rating) (40: genres) (82: platforms) (89: availableonsteam) (108: haslinuxrelease) (117: hasmacrelease)
"name[Super Mario World], release_year[1990], esrb[E (for Everyone)], rating[excellent], genres[platformer], player_perspective[side view], has_multiplayer[yes], platforms[Nintendo]",super mario world is an excellent platformer that came out in 1990 for nintendo only . this game is rated e ( for everyone ) and has a side view perspective . you can also play multiplayer .,(0: name) (24: rating) (34: genres) (62: releaseyear) (71: platforms) (100: esrb) (134: playerperspective) (175: hasmultiplayer)
"name[Super Mario World], release_year[1990], esrb[E (for Everyone)], rating[excellent], genres[platformer], player_perspective[side view], has_multiplayer[yes], platforms[Nintendo]",super mario world is an excellent platformer game that is played in the side view . it was released in 1990 on nintendo and is rated e for everyone . it can be played multiplayer .,(0: name) (24: rating) (34: genres) (72: playerperspective) (103: releaseyear) (111: platforms) (127: esrb) (165: hasmultiplayer)
"name[Super Mario World], release_year[1990], esrb[E (for Everyone)], rating[excellent], genres[platformer], player_perspective[side view], has_multiplayer[yes], platforms[Nintendo]","super mario world is an excellent 1990 nintendo platformer . it is a side view game game with multiplayer , and it is rated e ( for everyone ) .",(0: name) (24: rating) (34: releaseyear) (39: platforms) (48: genres) (68: playerperspective) (93: hasmultiplayer) (118: esrb)
"name[Transport Tycoon], release_year[1994], genres[simulation; strategy], platforms[PC], available_on_steam[no], has_linux_release[no], has_mac_release[no]","a good simulation strategy game from 1994 was transport tycoon . it was available on pc , not on linux or mac . unfortunately , you ca n't find it on steam .",(7: genres) (37: releaseyear) (46: name) (84: platforms) (95: haslinuxrelease) (104: hasmacrelease) (146: availableonsteam)
"name[Transport Tycoon], release_year[1994], genres[simulation; strategy], platforms[PC], available_on_steam[no], has_linux_release[no], has_mac_release[no]","transport tycoon is a simulation and strategy game released for the pc platform . the original release was 1994. currently , the game is not available on steam and does not have a linux or mac release .",(0: name) (22: genres) (68: platforms) (107: releaseyear) (151: availableonsteam) (177: haslinuxrelease) (186: hasmacrelease)
"name[Transport Tycoon], release_year[1994], genres[simulation; strategy], platforms[PC], available_on_steam[no], has_linux_release[no], has_mac_release[no]","transport tycoon is a simulation strategy game that came out in 1994 and is available on pc . the game is not available on steam , linux , or mac .",(0: name) (22: genres) (64: releaseyear) (89: platforms) (122: availableonsteam) (129: haslinuxrelease) (139: hasmacrelease)
"name[Little Nightmares], genres[adventure; platformer; puzzle], platforms[PlayStation; Xbox; PC], available_on_steam[yes]","little nightmares is an adventure puzzle-platformer , available on steam for pc . the game is also available on playstation and xbox .",(0: name) (24: genres) (66: availableonsteam) (76: platforms)
"name[Little Nightmares], genres[adventure; platformer; puzzle], platforms[PlayStation; Xbox; PC], available_on_steam[yes]","little nightmares is an adventure puzzle platformer that is out on playstation , xbox , pc , and steam .",(0: name) (24: genres) (67: platforms) (94: availableonsteam)
"name[Little Nightmares], genres[adventure; platformer; puzzle], platforms[PlayStation; Xbox; PC], available_on_steam[yes]","the puzzle-platformer little nightmares is available on steam . the adventure game can be played on playstation , xbox and pc .",(4: genres) (22: name) (56: availableonsteam) (100: platforms)
"name[Mass Effect 2], release_year[2010], developer[BioWare], esrb[M (for Mature)], genres[action-adventure; role-playing; shooter], player_perspective[third person], platforms[PlayStation; Xbox; PC]","mass effect 2 is an action-adventure shooter rpg by bioware , released for playstation , xbox , and pc . the game is played from third person perspective and is rated m ( for mature ) .",(0: name) (20: genres) (52: developer) (75: platforms) (129: playerperspective) (161: esrb)
"name[Mass Effect 2], release_year[2010], developer[BioWare], esrb[M (for Mature)], genres[action-adventure; role-playing; shooter], player_perspective[third person], platforms[PlayStation; Xbox; PC]","bioware 's m-rated game mass effect 2 came out in 2010. it is a third person perspective role-playing shooter . this action-adventure game is available to play on playstation , xbox and pc .",(0: developer) (10: esrb) (24: name) (50: releaseyear) (64: playerperspective) (89: genres) (163: platforms)
"name[Mass Effect 2], release_year[2010], developer[BioWare], esrb[M (for Mature)], genres[action-adventure; role-playing; shooter], player_perspective[third person], platforms[PlayStation; Xbox; PC]","another action-adventure role-playing shooter game was mass effect 2 from bioware . it was released in 2010 for playstation , xbox and pc . you play the game from the third person perspective , and it is rated m for mature .",(8: genres) (55: name) (74: developer) (103: releaseyear) (112: platforms) (167: playerperspective) (204: esrb)
"name[Quantum Break], release_year[2016], esrb[M (for Mature)], genres[adventure; shooter]",quantum break is an adventure shooter game that was released in 2016. it was rated m for mature .,(0: name) (20: genres) (64: releaseyear) (77: esrb)
"name[Quantum Break], release_year[2016], esrb[M (for Mature)], genres[adventure; shooter]","quantum break is an adventure shooter that was released in the year 2016 , and is rated m ( for mature ) .",(0: name) (20: genres) (68: releaseyear) (82: esrb)
"name[Quantum Break], release_year[2016], esrb[M (for Mature)], genres[adventure; shooter]",quantum break is a 2016 adventure shooter that was rated m ( for mature ) .,(0: name) (19: releaseyear) (24: genres) (51: esrb)
"name[World of Warcraft], release_year[2004], developer[Blizzard Entertainment], genres[adventure; MMORPG], player_perspective[third person]",world of warcraft by blizzard entertainment was released in 2004. it 's an adventure mmorpg that is played in the third person .,(0: name) (21: developer) (60: releaseyear) (75: genres) (114: playerperspective)
"name[World of Warcraft], release_year[2004], developer[Blizzard Entertainment], genres[adventure; MMORPG], player_perspective[third person]",world of warcraft is a third person adventure mmorpg . it was developed by blizzard entertainment and released in 2004 .,(0: name) (23: playerperspective) (36: genres) (75: developer) (114: releaseyear)
"name[World of Warcraft], release_year[2004], developer[Blizzard Entertainment], genres[adventure; MMORPG], player_perspective[third person]",world of warcraft is a third person adventure mmorpg released in 2004 and developed by blizzard entertainment .,(0: name) (23: playerperspective) (36: genres) (65: releaseyear) (87: developer)
"name[Rocket League], release_year[2015], esrb[E (for Everyone)], genres[sport; vehicular combat], has_multiplayer[yes]","a vehicular combat game featuring sport aspects , rocket league , was released in 2015. the game is rated e for everyone and offers a multiplayer mode .",(2: genres) (50: name) (82: releaseyear) (100: esrb) (131: hasmultiplayer)
"name[Rocket League], release_year[2015], esrb[E (for Everyone)], genres[sport; vehicular combat], has_multiplayer[yes]",rocket league was released in 2015 with an e ( for everyone ) rating . it 's a sports and vehicular combat game that can be played in a multiplayer mode .,(0: name) (30: releaseyear) (51: esrb) (79: genres) (135: hasmultiplayer)
"name[Rocket League], release_year[2015], esrb[E (for Everyone)], genres[sport; vehicular combat], has_multiplayer[yes]","if you 're looking for a game that 's rated e ( for everyone ) , the multiplayer game , rocket league , will have you playing with your family for hours . it 's a vehicular combat sports game from 2015 .",(36: esrb) (68: hasmultiplayer) (88: name) (163: genres) (197: releaseyear)
"name[SpellForce 3], genres[real-time strategy; role-playing], has_multiplayer[yes], platforms[PC], has_linux_release[no], has_mac_release[no]","a multiplayer rpg real-time strategy you can play with friends is spellforce 3. it 's only available on pc , but without mac or linux support .",(2: hasmultiplayer) (14: genres) (66: name) (103: platforms) (119: hasmacrelease) (126: haslinuxrelease)
"name[SpellForce 3], genres[real-time strategy; role-playing], has_multiplayer[yes], platforms[PC], has_linux_release[no], has_mac_release[no]","spellforce 3 is a multiplayer , real-time strategy , role-playing game . it is out on pc , but does not have a release for linux or mac .",(0: name) (18: hasmultiplayer) (32: genres) (83: platforms) (119: haslinuxrelease) (128: hasmacrelease)
"name[SpellForce 3], genres[real-time strategy; role-playing], has_multiplayer[yes], platforms[PC], has_linux_release[no], has_mac_release[no]",spellforce 3 is a multiplayer game that was only released on pc . it is a role-playing real-time strategy that does not have linux or mac releases .,(0: name) (18: hasmultiplayer) (61: platforms) (74: genres) (124: haslinuxrelease) (133: hasmacrelease)
"name[Far Cry 3], developer[Ubisoft Massive], genres[action-adventure; shooter], player_perspective[first person]","far cry 3 , developed by ubisoft massive , is an action-adventure shooter game played in first person .",(0: name) (25: developer) (49: genres) (89: playerperspective)
"name[Far Cry 3], developer[Ubisoft Massive], genres[action-adventure; shooter], player_perspective[first person]",far cry 3 is a first person action-adventure shooter developed by ubisoft massive .,(0: name) (15: playerperspective) (28: genres) (66: developer)
"name[Far Cry 3], developer[Ubisoft Massive], genres[action-adventure; shooter], player_perspective[first person]",far cry 3 is an action-adventure shooter from an entirely first person perspective . it 's under the care of ubisoft massive .,(0: name) (16: genres) (58: playerperspective) (109: developer)
"name[Ori and the Blind Forest], release_year[2015], rating[excellent], genres[adventure; platformer; puzzle], player_perspective[side view], platforms[Xbox; PC], available_on_steam[yes]",ori and the blind forest is an excellent side view adventure puzzle platformer . this 2015 game is on xbox and pc through steam .,(0: name) (31: rating) (41: playerperspective) (51: genres) (86: releaseyear) (101: platforms) (121: availableonsteam)
"name[Ori and the Blind Forest], release_year[2015], rating[excellent], genres[adventure; platformer; puzzle], player_perspective[side view], platforms[Xbox; PC], available_on_steam[yes]",ori and the blind forest is an excellent adventure platformer that came out in 2015 for pc and xbox only . the puzzle game is played in side view and is on steam .,(0: name) (31: rating) (41: genres) (79: releaseyear) (88: platforms) (135: playerperspective) (155: availableonsteam)
"name[Ori and the Blind Forest], release_year[2015], rating[excellent], genres[adventure; platformer; puzzle], player_perspective[side view], platforms[Xbox; PC], available_on_steam[yes]","ori and the blind forest is a great adventure side view platformer from 2015 that 's full of puzzles to solve . you can get it on steam for pc , or play it on xbox .",(0: name) (30: rating) (36: genres) (46: playerperspective) (72: releaseyear) (129: availableonsteam) (139: platforms)
"name[Lara Croft and the Temple of Osiris], release_year[2014], genres[action-adventure; puzzle; shooter], player_perspective[bird view], has_multiplayer[yes]","lara croft and the temple of osiris is a 2014 action-adventure , puzzle , shooter with a bird view player perspective and multiplayer mode .",(0: name) (41: releaseyear) (46: genres) (87: playerperspective) (120: hasmultiplayer)
"name[Lara Croft and the Temple of Osiris], release_year[2014], genres[action-adventure; puzzle; shooter], player_perspective[bird view], has_multiplayer[yes]",lara croft and the temple of osiris is an action-adventure shooter with puzzles . it gives players a bird view perspective and has multiplayer mode . it came out in 2014 .,(0: name) (42: genres) (100: playerperspective) (130: hasmultiplayer) (165: releaseyear)
"name[Lara Croft and the Temple of Osiris], release_year[2014], genres[action-adventure; puzzle; shooter], player_perspective[bird view], has_multiplayer[yes]","in 2014 , lara croft and the temple of osiris introduced multiplayer and a bird view playing style in an action-adventure shooter with puzzle elements .",(3: releaseyear) (10: name) (56: hasmultiplayer) (74: playerperspective) (105: genres)
"name[Tom Clancy's Splinter Cell: Chaos Theory], release_year[2005], genres[action; tactical], player_perspective[first person; third person], has_multiplayer[yes]","tom clancy 's splinter cell : chaos theory is a tactical action game that came out in 2005. this game can be played from either the first person or third person perspective , and you can play multiplayer .",(0: name) (48: genres) (86: releaseyear) (132: playerperspective) (190: hasmultiplayer)
"name[Tom Clancy's Splinter Cell: Chaos Theory], release_year[2005], genres[action; tactical], player_perspective[first person; third person], has_multiplayer[yes]",tom clancy 's splinter cell : chaos theory is a tactical action game that was released in 2005. it has multiplayer capabilities and is played in first and third person perspective .,(0: name) (48: genres) (90: releaseyear) (102: hasmultiplayer) (145: playerperspective)
