mr,ref,alignment
"name[Need for Speed: Payback], esrb[T (for Teen)], rating[poor], genres[driving/racing], has_multiplayer[yes], platforms[PlayStation; Xbox; PC], has_linux_release[no], has_mac_release[no]","need for speed : payback is a poor driving racing type game that has a t rating and featured multiplayer modes . it could be played on playstation , xbox , and pc , but not linux or mac .",(0: name) (30: rating) (35: genres) (71: esrb) (93: hasmultiplayer) (135: platforms) (169: haslinuxrelease) (178: hasmacrelease)
"name[Need for Speed: Payback], esrb[T (for Teen)], rating[poor], genres[driving/racing], has_multiplayer[yes], platforms[PlayStation; Xbox; PC], has_linux_release[no], has_mac_release[no]","a poor multiplayer driving/racing game is need for speed : payback . it was released on playstation and xbox . it was on pc , too , but not on mac , nor linux . it is rated t ( for teen ) .",(2: rating) (7: hasmultiplayer) (19: genres) (42: name) (88: platforms) (139: hasmacrelease) (148: haslinuxrelease) (167: esrb)
"name[Need for Speed: Payback], esrb[T (for Teen)], rating[poor], genres[driving/racing], has_multiplayer[yes], platforms[PlayStation; Xbox; PC], has_linux_release[no], has_mac_release[no]","the playstation and xbox game , need for speed : payback , is a suitable game for teenagers , as it offers driving/racing multiplayer features . while the game is not an option for linux or mac users , it is available for pc despite the poor ratings .",(4: platforms) (32: name) (82: esrb) (107: genres) (119: hasmultiplayer) (177: haslinuxrelease) (186: hasmacrelease) (232: rating)
"name[Assassin's Creed Chronicles: India], release_year[2016], rating[poor], genres[action-adventure; platformer], platforms[PlayStation; Xbox; PC], available_on_steam[yes], has_linux_release[no], has_mac_release[no]","assassin 's creed chronicles : india was a poor action-adventure platformer released in 2016 for the playstation , xbox , and pc . you can get it on steam , but you ca n't play it on linux or mac .",(0: name) (43: rating) (48: genres) (88: releaseyear) (101: platforms) (146: availableonsteam) (179: haslinuxrelease) (188: hasmacrelease)
"name[Assassin's Creed Chronicles: India], release_year[2016], rating[poor], genres[action-adventure; platformer], platforms[PlayStation; Xbox; PC], available_on_steam[yes], has_linux_release[no], has_mac_release[no]","assassin 's creed chronicles : india is a poor action-adventure platformer from 2016. it can be played on multiple platforms including pc , xbox , playstation , and is available on steam . it did not have a release on linux or mac .",(0: name) (42: rating) (47: genres) (80: releaseyear) (134: platforms) (177: availableonsteam) (213: haslinuxrelease) (222: hasmacrelease)
"name[Assassin's Creed Chronicles: India], release_year[2016], rating[poor], genres[action-adventure; platformer], platforms[PlayStation; Xbox; PC], available_on_steam[yes], has_linux_release[no], has_mac_release[no]","assassin 's creed chronicles : india turned out to be pretty bad . it came out in 2016 and is an action-adventure platformer . it is available on playstation , xbox , and pc , and even though it has a steam release , there are no mac or linux versions .",(0: name) (61: rating) (82: releaseyear) (97: genres) (146: platforms) (196: availableonsteam) (224: hasmacrelease) (231: haslinuxrelease)
"name[Mafia], release_year[2002], esrb[M (for Mature)], rating[excellent], genres[driving/racing; fighting; shooter], player_perspective[third person]","if you like games with fighting , mafia is an excellent game that is rated m ( for mature ) . it is a third person driving/racing shooter .",(23: genres) (34: name) (46: rating) (69: esrb) (102: playerperspective)
"name[Mafia], release_year[2002], esrb[M (for Mature)], rating[excellent], genres[driving/racing; fighting; shooter], player_perspective[third person]",mafia is an excellent driving/racing and fighting third person shooter that was out in 2002 with an m ( for mature ) rating .,(0: name) (12: rating) (22: genres) (50: playerperspective) (87: releaseyear) (108: esrb)
"name[Mafia], release_year[2002], esrb[M (for Mature)], rating[excellent], genres[driving/racing; fighting; shooter], player_perspective[third person]","in 2002 an excellent game called mafia was released . it is a third person shooting , fighting and driving game . it is an adult game that 's rated m for mature .",(3: releaseyear) (11: rating) (33: name) (62: playerperspective) (75: genres) (123: esrb)
"name[The Vanishing of Ethan Carter], release_year[2014], developer[The Astronauts], esrb[M (for Mature)], genres[adventure; indie], player_perspective[first person], platforms[PlayStation; Xbox; PC], available_on_steam[yes]","you can get the vanishing of ethan carter by the astronauts on steam , playstation , xbox , and pc . it is a first person , indie , adventure game rated m from 2014 .",(12: name) (45: developer) (63: availableonsteam) (71: platforms) (109: playerperspective) (124: genres) (147: esrb) (160: releaseyear)
"name[The Vanishing of Ethan Carter], release_year[2014], developer[The Astronauts], esrb[M (for Mature)], genres[adventure; indie], player_perspective[first person], platforms[PlayStation; Xbox; PC], available_on_steam[yes]","the vanishing of ethan carter is a game released on steam in 2014 by the astronauts . it is an indie adventure game viewed in first person . it is rated m ( for mature ) by esrb and available on playstation , xbox and pc via steam .",(0: name) (61: releaseyear) (69: developer) (95: genres) (126: playerperspective) (147: esrb) (195: platforms) (222: availableonsteam)
"name[The Vanishing of Ethan Carter], release_year[2014], developer[The Astronauts], esrb[M (for Mature)], genres[adventure; indie], player_perspective[first person], platforms[PlayStation; Xbox; PC], available_on_steam[yes]","the vanishing of ethan carter is a decent first person adventure game from 2014 , rated m ( for mature ) . it was developed by the indie studio the astronauts for playstation , xbox and pc . oh , and you can get in on steam .",(0: name) (42: playerperspective) (55: genres) (75: releaseyear) (82: esrb) (144: developer) (163: platforms) (213: availableonsteam)
"name[Resident Evil 4], release_year[2005], rating[excellent], genres[action-adventure; shooter], player_perspective[third person]",resident evil 4 is an excellent third person shooter game . this action-adventure game came out 2005 .,(0: name) (22: rating) (32: playerperspective) (45: genres) (96: releaseyear)
"name[Resident Evil 4], release_year[2005], rating[excellent], genres[action-adventure; shooter], player_perspective[third person]","resident evil 4 from 2005 is an excellent , dark , action-adventure shooter . its use of third person point of view makes the game fun .",(0: name) (21: releaseyear) (32: rating) (51: genres) (89: playerperspective)
"name[Resident Evil 4], release_year[2005], rating[excellent], genres[action-adventure; shooter], player_perspective[third person]","resident evil 4 is considered an excellent action-adventure , third person shooter and was released in 2005 .",(0: name) (33: rating) (43: genres) (62: playerperspective) (103: releaseyear)
"name[Crysis], developer[Crytek Frankfurt], esrb[M (for Mature)], genres[action-adventure; shooter], player_perspective[first person], has_multiplayer[yes]","crysis is a first person action-adventure , shooter game that offers a multiplayer aspect . it was made by the developer crytek frankfurt and received a esrb rating of m ( for mature ) .",(0: name) (12: playerperspective) (25: genres) (70: hasmultiplayer) (121: developer) (176: esrb)
"name[Crysis], developer[Crytek Frankfurt], esrb[M (for Mature)], genres[action-adventure; shooter], player_perspective[first person], has_multiplayer[yes]",crysis is an action-adventure first person shooter by crytek frankfurt . this game has an m ( for mature ) rating and can be played multiplayer .,(0: name) (13: genres) (30: playerperspective) (54: developer) (98: esrb) (131: hasmultiplayer)
"name[Crysis], developer[Crytek Frankfurt], esrb[M (for Mature)], genres[action-adventure; shooter], player_perspective[first person], has_multiplayer[yes]","crysis , developed by crytek frankfurt , is an action-adventure and shooter game played in first person . it has multiplayer capabilities and is rated m ( for mature ) .",(0: name) (22: developer) (47: genres) (91: playerperspective) (110: hasmultiplayer) (145: esrb)
"name[The Elder Scrolls Online], release_year[2014], rating[average], genres[MMORPG], player_perspective[first person; third person]",the elder scrolls online is an average mmorpg released on 2014. it is played in either first person or third person .,(0: name) (31: rating) (39: genres) (58: releaseyear) (87: playerperspective)
"name[The Elder Scrolls Online], release_year[2014], rating[average], genres[MMORPG], player_perspective[first person; third person]",a decent game to try is the mmorpg the elder scrolls online . you can play it in first person or third person perspective .,(2: rating) (28: genres) (35: name) (81: playerperspective)
"name[The Elder Scrolls Online], release_year[2014], rating[average], genres[MMORPG], player_perspective[first person; third person]","the elder scrolls online is an mmorpg released in 2014 that is quite average compared to other games in this genre , despite allowing first person perspective , as well as third person .",(0: name) (31: genres) (50: releaseyear) (69: rating) (134: playerperspective)
"name[Crysis], release_year[2007], rating[good], genres[action-adventure; shooter], player_perspective[first person]",crysis is a first person shooter released in 2007. the action-adventure game was reviewed as good .,(0: name) (12: playerperspective) (25: genres) (45: releaseyear) (92: rating)
"name[Crysis], release_year[2007], rating[good], genres[action-adventure; shooter], player_perspective[first person]","crysis is a good action-adventure , first person shooter game which was released in 2007 .",(0: name) (12: rating) (17: genres) (36: playerperspective) (84: releaseyear)
"name[Crysis], release_year[2007], rating[good], genres[action-adventure; shooter], player_perspective[first person]",crysis was a good first person shooter . it was an action-adventure game from 2007 .,(0: name) (13: rating) (18: playerperspective) (31: genres) (78: releaseyear)
"name[Need for Speed: Shift], esrb[E (for Everyone)], genres[driving/racing; simulation], player_perspective[first person; third person], platforms[PlayStation; Xbox; PC], available_on_steam[yes], has_linux_release[no], has_mac_release[no]","need for speed : shift is a playstation , xbox , and pc driving/racing , simulation game . you can switch between first person and third person perspective . it is rated e ( for everyone ) and available on steam . currently there is no linux or mac support .",(0: name) (28: platforms) (56: genres) (114: playerperspective) (164: esrb) (201: availableonsteam) (230: haslinuxrelease) (239: hasmacrelease)
"name[Need for Speed: Shift], esrb[E (for Everyone)], genres[driving/racing; simulation], player_perspective[first person; third person], platforms[PlayStation; Xbox; PC], available_on_steam[yes], has_linux_release[no], has_mac_release[no]","need for speed : shift is a driving/racing simulator with first person and third person that plays on playstation , xbox and pc and that you can find on steam , though it does not have a linux or mac release . it is rated e ( for everyone ) .",(0: name) (28: genres) (58: playerperspective) (102: platforms) (152: availableonsteam) (185: haslinuxrelease) (194: hasmacrelease) (216: esrb)
"name[Need for Speed: Shift], esrb[E (for Everyone)], genres[driving/racing; simulation], player_perspective[first person; third person], platforms[PlayStation; Xbox; PC], available_on_steam[yes], has_linux_release[no], has_mac_release[no]","need for speed : shift is a driving/racing simulatior that is available on steam . it can be played in either first or third person . it was released for playstation , xbox and pc , but not for linux or mac . it has an e rating ( for everyone ) .",(0: name) (28: genres) (75: availableonsteam) (110: playerperspective) (154: platforms) (190: haslinuxrelease) (199: hasmacrelease) (219: esrb)
"name[Age of Empires II: The Age of Kings], release_year[1999], genres[real-time strategy], player_perspective[bird view]",age of empires ii : the age of kings was released in 1999 as a real-time strategy with a bird view perspective .,(0: name) (53: releaseyear) (63: genres) (89: playerperspective)
"name[Age of Empires II: The Age of Kings], release_year[1999], genres[real-time strategy], player_perspective[bird view]",age of empires ii : the age of kings is a bird 's eye view real-time strategy game released in 1999 .,(0: name) (42: playerperspective) (59: genres) (95: releaseyear)
"name[Age of Empires II: The Age of Kings], release_year[1999], genres[real-time strategy], player_perspective[bird view]",age of empires ii : the age of kings is a bird view real-time strategy released in 1999 .,(0: name) (42: playerperspective) (52: genres) (83: releaseyear)
"name[NBA 2K16], genres[sport], player_perspective[third person], platforms[PlayStation; Xbox; PC], available_on_steam[yes]","nba 2k16 is a third person sports game . it is available on all platforms including playstation , xbox , pc and steam .",(0: name) (14: playerperspective) (27: genres) (84: platforms) (109: availableonsteam)
"name[NBA 2K16], genres[sport], player_perspective[third person], platforms[PlayStation; Xbox; PC], available_on_steam[yes]","nba 2k16 is a third person sport game . this game can be played on playstation , xbox , and pc , and can be downloaded from steam .",(0: name) (14: playerperspective) (27: genres) (67: platforms) (120: availableonsteam)
"name[NBA 2K16], genres[sport], player_perspective[third person], platforms[PlayStation; Xbox; PC], available_on_steam[yes]","nba 2k16 is a third person sports game you can get on steam . it was released for playstation , xbox and pc .",(0: name) (14: playerperspective) (27: genres) (54: availableonsteam) (82: platforms)
"name[Grand Theft Auto V], release_year[2013], rating[excellent], genres[action-adventure; driving/racing; shooter], player_perspective[first person; third person], has_multiplayer[yes]","grand theft auto v , released in 2013 , is an excellent first or third person action-adventure , driving/racing and shooter game . it is playable in multiplayer mode .",(0: name) (33: releaseyear) (46: rating) (56: playerperspective) (78: genres) (145: hasmultiplayer)
"name[Grand Theft Auto V], release_year[2013], rating[excellent], genres[action-adventure; driving/racing; shooter], player_perspective[first person; third person], has_multiplayer[yes]","grand theft auto v is an excellent , multiplayer action-adventure , driving/racing , shooter that was released in 2013. it can played in either first person or third person .",(0: name) (25: rating) (36: hasmultiplayer) (49: genres) (114: releaseyear) (144: playerperspective)
"name[Grand Theft Auto V], release_year[2013], rating[excellent], genres[action-adventure; driving/racing; shooter], player_perspective[first person; third person], has_multiplayer[yes]","grand theft auto v is a first person and third person driving/racing , shooter , action-adventure game that offers multiplayer . it was released in 2013 and received excellent ratings .",(0: name) (24: playerperspective) (54: genres) (113: hasmultiplayer) (148: releaseyear) (166: rating)
"name[MotorStorm: Apocalypse], release_year[2011], developer[Evolution Studios], genres[vehicular combat], player_perspective[third person], platforms[PlayStation]","motorstorm : apocalypse is a third person , vehicular combat released by evolution studios for playstation in 2011 .",(0: name) (29: playerperspective) (44: genres) (73: developer) (95: platforms) (110: releaseyear)
"name[MotorStorm: Apocalypse], release_year[2011], developer[Evolution Studios], genres[vehicular combat], player_perspective[third person], platforms[PlayStation]",motorstorm : apocalypse is a 2011 racing 3d video game by evolution studios and published by sony computer entertainment for playstation . the game plays in third person and features non-stop action and vehicular combat .,(0: name) (29: releaseyear) (58: developer) (125: platforms) (157: playerperspective) (203: genres)
"name[MotorStorm: Apocalypse], release_year[2011], developer[Evolution Studios], genres[vehicular combat], player_perspective[third person], platforms[PlayStation]","motorstorm : apocalypse , developed by evolution studios in 2011 , is a third person vehicular combat game for playstation only .",(0: name) (39: developer) (60: releaseyear) (72: playerperspective) (85: genres) (111: platforms)
"name[Madden NFL 15], developer[EA Tiburon], genres[simulation; sport]",madden nfl 15 is a simulation-sport game made by ea tiburon .,(0: name) (19: genres) (49: developer)
"name[Madden NFL 15], developer[EA Tiburon], genres[simulation; sport]",madden nfl 15 is a simulation sport game by ea tiburon .,(0: name) (19: genres) (44: developer)
"name[Madden NFL 15], developer[EA Tiburon], genres[simulation; sport]",madden nfl 15 is a sport simulation game that was released by ea tiburon .,(0: name) (19: genres) (62: developer)
"name[The Wolf Among Us], release_year[2013], genres[adventure; point-and-click], player_perspective[third person], platforms[PlayStation; Xbox; PC], available_on_steam[yes], has_linux_release[no], has_mac_release[yes]","the wolf among us is a 2013 third person point-and-click adventure game . it is on playstation , xbox , and pc through steam . there is a mac release but no linux .",(0: name) (23: releaseyear) (28: playerperspective) (41: genres) (83: platforms) (116: availableonsteam) (134: hasmacrelease) (153: haslinuxrelease)
"name[The Wolf Among Us], release_year[2013], genres[adventure; point-and-click], player_perspective[third person], platforms[PlayStation; Xbox; PC], available_on_steam[yes], has_linux_release[no], has_mac_release[yes]","the wolf among us is a third person point-and-click adventure game released in 2013. it 's available on playstation , xbox , and pc through steam . the game has a mac release alongside pc , but has no linux counterpart .",(0: name) (23: playerperspective) (36: genres) (79: releaseyear) (104: platforms) (137: availableonsteam) (159: hasmacrelease) (196: haslinuxrelease)
"name[The Wolf Among Us], release_year[2013], genres[adventure; point-and-click], player_perspective[third person], platforms[PlayStation; Xbox; PC], available_on_steam[yes], has_linux_release[no], has_mac_release[yes]","the wolf among us is a third person point-and-click adventure game released in 2013. it was released for playstation , xbox , pc , mac and steam . it has no linux support .",(0: name) (23: playerperspective) (36: genres) (79: releaseyear) (105: platforms) (127: hasmacrelease) (135: availableonsteam) (152: haslinuxrelease)
"name[Resident Evil 4], release_year[2005], rating[excellent], genres[action-adventure; shooter], platforms[PlayStation; Xbox; Nintendo; PC], available_on_steam[yes], has_linux_release[no], has_mac_release[no]","resident evil 4 is an excellent action-adventure shooter . it came out in 2005 for playstation , xbox , nintendo , and pc , but it is not supported on mac or linux . it is available on steam .",(0: name) (22: rating) (32: genres) (74: releaseyear) (83: platforms) (146: hasmacrelease) (153: haslinuxrelease) (179: availableonsteam)
"name[Resident Evil 4], release_year[2005], rating[excellent], genres[action-adventure; shooter], platforms[PlayStation; Xbox; Nintendo; PC], available_on_steam[yes], has_linux_release[no], has_mac_release[no]","resident evil 4 is an awesome action-adventure shooter released in 2005. it 's available on playstation , xbox , nintendo , and pc , as well as a digital release on steam . the game is not available on linux or mac .",(0: name) (22: rating) (30: genres) (67: releaseyear) (92: platforms) (160: availableonsteam) (196: haslinuxrelease) (205: hasmacrelease)
"name[Resident Evil 4], release_year[2005], rating[excellent], genres[action-adventure; shooter], platforms[PlayStation; Xbox; Nintendo; PC], available_on_steam[yes], has_linux_release[no], has_mac_release[no]","the excellent 2005 release of resident evil 4 is great for action-adventure or shooter fans . the game is now available on playstation , xbox , nintendo , pc and through steam , but no mac or linux versions are offered .",(4: rating) (14: releaseyear) (30: name) (59: genres) (123: platforms) (166: availableonsteam) (180: hasmacrelease) (187: haslinuxrelease)
"name[Mafia], genres[driving/racing; fighting; shooter], platforms[PlayStation; Xbox; PC]","mafia is a driving/racing , fighting , shooter game out for playstation , xbox , pc .",(0: name) (11: genres) (60: platforms)
"name[Mafia], genres[driving/racing; fighting; shooter], platforms[PlayStation; Xbox; PC]","mafia is driving/racing , fighting , shooter game released on the playstation , xbox , and pc .",(0: name) (9: genres) (66: platforms)
"name[Mafia], genres[driving/racing; fighting; shooter], platforms[PlayStation; Xbox; PC]","mafia was released on pc , playstation , and xbox . as a game about a mob footsoldier , it was built on fighting , shooting , and driving ( sometimes in competitive races ) .",(0: name) (22: platforms) (104: genres)
"name[BioShock], rating[good], genres[action-adventure; role-playing; shooter], player_perspective[first person]","if you want a good first person , action-adventure role-playing shooter , try bioshock .",(14: rating) (19: playerperspective) (34: genres) (78: name)
"name[BioShock], rating[good], genres[action-adventure; role-playing; shooter], player_perspective[first person]","if you like role-playing games , bioshock is a first person action-adventure , shooter with good ratings .",(12: genres) (33: name) (47: playerperspective) (90: rating)
"name[BioShock], rating[good], genres[action-adventure; role-playing; shooter], player_perspective[first person]","if you 're looking for a good action-adventure , role-playing , shooter game you should try bioshock . the game is played in first person perspective .",(25: rating) (30: genres) (92: name) (125: playerperspective)
"name[Transport Tycoon], release_year[1994], genres[simulation; strategy]",transport tycoon from 1994 is a simulation strategy game .,(0: name) (22: releaseyear) (32: genres)
"name[Transport Tycoon], release_year[1994], genres[simulation; strategy]",transport tycoon is a simulation strategy game . it came out in 1994 .,(0: name) (22: genres) (64: releaseyear)
"name[Transport Tycoon], release_year[1994], genres[simulation; strategy]","released in 1994 , transport tycoon is a simulation and strategy game .",(12: releaseyear) (19: name) (41: genres)
"name[TrackMania Turbo], genres[arcade; driving/racing], platforms[PlayStation; Xbox; PC], available_on_steam[yes]","an arcade-style racing game on playstation , xbox , and pc is trackmania turbo . it 's available on steam .",(3: genres) (31: platforms) (62: name) (97: availableonsteam)
"name[TrackMania Turbo], genres[arcade; driving/racing], platforms[PlayStation; Xbox; PC], available_on_steam[yes]","the driving/racing arcade game trackmania turbo is available on playstation , xbox , pc and through steam .",(4: genres) (31: name) (64: platforms) (98: availableonsteam)
"name[TrackMania Turbo], genres[arcade; driving/racing], platforms[PlayStation; Xbox; PC], available_on_steam[yes]","trackmania turbo is an arcade , driving/racing game for playstation , xbox , pc and is currently available on steam .",(0: name) (23: genres) (56: platforms) (107: availableonsteam)
"name[Worms: Reloaded], release_year[2010], developer[Team17 Digital Ltd], genres[action; platformer; strategy], platforms[PC], available_on_steam[yes], has_linux_release[yes], has_mac_release[yes]","try worms : reloaded , it 's a 2010 strategic action-platformer from team17 digital ltd for the pc available through steam . there is linux and mac support too .",(4: name) (31: releaseyear) (36: genres) (69: developer) (95: platforms) (116: availableonsteam) (132: haslinuxrelease) (142: hasmacrelease)
"name[Worms: Reloaded], release_year[2010], developer[Team17 Digital Ltd], genres[action; platformer; strategy], platforms[PC], available_on_steam[yes], has_linux_release[yes], has_mac_release[yes]",worms : reloaded is a pc-exclusive action-strategy game from 2010 by team17 digital ltd. you control the worms in a combination of an artillery game and a platformer . it also has mac and linux ports .,(0: name) (22: platforms) (35: genres) (61: releaseyear) (69: developer) (178: hasmacrelease) (186: haslinuxrelease)
"name[Worms: Reloaded], release_year[2010], developer[Team17 Digital Ltd], genres[action; platformer; strategy], platforms[PC], available_on_steam[yes], has_linux_release[yes], has_mac_release[yes]","worms : reloaded , developed by team17 digital ltd , is a strategy action-platformer . it was released in 2010 for the pc , and is available on steam , linux , and mac .",(0: name) (32: developer) (58: genres) (106: releaseyear) (116: platforms) (140: availableonsteam) (147: haslinuxrelease) (158: hasmacrelease)
"name[Trivial Pursuit], release_year[2009], developer[Electronic Arts], genres[trivia/board game], has_multiplayer[yes]",trivial pursuit was developed in 2009 by electronic arts for multiplayer trivia/board game lovers .,(0: name) (33: releaseyear) (41: developer) (61: hasmultiplayer) (73: genres)
"name[Trivial Pursuit], release_year[2009], developer[Electronic Arts], genres[trivia/board game], has_multiplayer[yes]",trivial pursuit is a multiplayer trivia/board game . it was released by electronic arts in 2009 .,(0: name) (21: hasmultiplayer) (33: genres) (72: developer) (91: releaseyear)
