mr,ref
"confirm(name[Ancient Cities], developer[Uncasual Games])",Ancient Cities? From Uncasual Games?
"confirm(name[Ancient Cities], developer[Uncasual Games])",Are you talking about the Ancient Cities that was made by Uncasual Games?
"confirm(name[Ancient Cities], developer[Uncasual Games])",Do you mean the Ancient Cities released by Uncasual Games?
"confirm(name[Ancient Cities], exp_release_date[December 1, 2018])","Do you mean the Ancient Cities that is expected to be released on December 1, 2018?"
"confirm(name[Ancient Cities], exp_release_date[December 1, 2018])","Do you mean Ancient Cities, coming December 1, 2018?"
"confirm(name[Ancient Cities], exp_release_date[December 1, 2018])","You mean the Ancient Cities that's not coming out till December 1, 2018, right?"
"confirm(name[Ancient Cities], genres[simulation, strategy])",Do you mean the Ancient Cities which is a strategy simulator?
"confirm(name[Ancient Cities], genres[simulation, strategy])","Do you mean the simulation strategy game, Ancient Cities?"
"confirm(name[Ancient Cities], genres[simulation, strategy])",Do you mean the strategy sim Ancient Cities?
"confirm(name[Ancient Cities], platforms[PC])",Are you talking about the Ancient Cities that is for the PC?
"confirm(name[Ancient Cities], platforms[PC])","You mean the Ancient Cities that's on the PC, right?"
"confirm(name[Ancient Cities], platforms[PC])","Do you mean the PC game, Ancient Cities?"
"confirm(name[Ancient Cities], player_perspective[bird view])",Are you talking about Ancient Cities with a bird view perspective?
"confirm(name[Ancient Cities], player_perspective[bird view])",Do you mean the Ancient Cities that you play from a bird view perspective?
"confirm(name[Ancient Cities], player_perspective[bird view])","So you're talking about the Ancient Cities with the bird view perspective, right?"
"confirm(name[Battlefield V], developer[EA Digital Illusions CE])","You're referring to the newest EA Digital Illusions CE game, Battlefield V, right?"
"confirm(name[Battlefield V], developer[EA Digital Illusions CE])","Oh, do you mean EA Digital Illusions CE's Battlefield V?"
"confirm(name[Battlefield V], developer[EA Digital Illusions CE])",Are you speaking about the Battlefield V that was made by EA Digital Illusions CE?
"confirm(name[Battlefield V], exp_release_date[October 16, 2018])","Are you referring to Battlefield V, expected to come out October 16, 2018?"
"confirm(name[Battlefield V], exp_release_date[October 16, 2018])","Are you talking about the Battlefield V that's being released on October 16, 2018?"
"confirm(name[Battlefield V], exp_release_date[October 16, 2018])","Did you mean Battlefield V, the game that is coming out on October 16, 2018?"
"confirm(name[Battlefield V], genres[action, shooter])","Are you talking about the action-shooter, Battlefield V?"
"confirm(name[Battlefield V], genres[action, shooter])",Were you referring to the Battlefield V that's an action shooter game?
"confirm(name[Battlefield V], genres[action, shooter])","Are you talking about the action-packed first person shooter, Battlefield V?"
"confirm(name[Battlefield V], has_multiplayer[yes])",Are you referring to the Battlefield V that has a multiplayer option?
"confirm(name[Battlefield V], has_multiplayer[yes])",Are you referring to the Battlefield V with multiplayer?
"confirm(name[Battlefield V], has_multiplayer[yes])",Are you talking about the multiplayer game Battlefield V?
"confirm(name[Battlefield V], platforms[Xbox])",Are you talking about Battlefield V for the Xbox?
"confirm(name[Battlefield V], platforms[Xbox])",Do you mean the Battlefield V for the Xbox?
"confirm(name[Battlefield V], platforms[Xbox])","Is that Battlefield V, available on Xbox?"
"confirm(name[Diablo II], developer[Blizzard North])",Are you talking about Diablo II from Blizzard North?
"confirm(name[Diablo II], developer[Blizzard North])","You're referring to one of Blizzard North's games, Diablo II, right?"
"confirm(name[Diablo II], developer[Blizzard North])",Do you mean the Diablo II that Blizzard North developed?
"confirm(name[Diablo II], has_mac_release[yes])",Do you mean Diablo II that was released on the Mac?
"confirm(name[Diablo II], has_mac_release[yes])",Are you talking about the Diablo II that you can play on Mac too?
"confirm(name[Diablo II], has_mac_release[yes])","Is this about the game Diablo II, that you can even play on Mac?"
"confirm(name[Diablo II], has_multiplayer[yes])",Are you talking about the Diablo II that has multiplayer?
"confirm(name[Diablo II], has_multiplayer[yes])","Are you talking about Diablo II, the multiplayer game?"
"confirm(name[Diablo II], has_multiplayer[yes])","Are you talking about Diablo II, one of the best multiplayer games?"
"confirm(name[Diablo II], platforms[PC])",Are you talking about the PC game Diablo II?
"confirm(name[Diablo II], platforms[PC])","Are you referring to Diablo II, the PC game?"
"confirm(name[Diablo II], platforms[PC])","You mentioned Diablo II, by that are you referring to the PC game?"
"confirm(name[Diablo II], release_year[2000])",Are you talking about Diablo II from 2000?
"confirm(name[Diablo II], release_year[2000])","Ah, do you mean the Diablo II that came out in 2000?"
"confirm(name[Diablo II], release_year[2000])","Are you talking about one of my favorite games, Diablo II, that came out in 2000?"
"confirm(name[Grand Theft Auto V], available_on_steam[yes])","Oh, do you mean the one that's on Steam too, Grand Theft Auto V?"
"confirm(name[Grand Theft Auto V], available_on_steam[yes])",So do you mean the Grand Theft Auto V on Steam?
"confirm(name[Grand Theft Auto V], available_on_steam[yes])",Is this the Grand Theft Auto V that's on Steam?
"confirm(name[Grand Theft Auto V], developer[Rockstar North])",Is the Grand Theft Auto V you just mentioned the one that was developed by Rockstar North?
"confirm(name[Grand Theft Auto V], developer[Rockstar North])",Do you mean the Grand Theft Auto V developed by Rockstar North?
"confirm(name[Grand Theft Auto V], developer[Rockstar North])",Are you referring to Grand Theft Auto V from Rockstar North?
"confirm(name[Grand Theft Auto V], esrb[M (for Mature)])",Is the Grand Theft Auto V you mentioned the one that got an M (for Mature) ESRB rating?
"confirm(name[Grand Theft Auto V], esrb[M (for Mature)])",Are you talking about the M rated game Grand Theft Auto V?
"confirm(name[Grand Theft Auto V], esrb[M (for Mature)])","This is the Grand Theft Auto V that's got an M rating, correct?"
"confirm(name[Grand Theft Auto V], player_perspective[third person])",Do you mean the Grand Theft Auto V that has got a third person perspective?
"confirm(name[Grand Theft Auto V], player_perspective[third person])",Are you referring to the third person Grand Theft Auto V?
"confirm(name[Grand Theft Auto V], player_perspective[third person])","Do you mean Grand Theft Auto V, the third person game?"
"confirm(name[Grand Theft Auto V], release_year[2013])",Do you mean Grand Theft Auto V from 2013?
"confirm(name[Grand Theft Auto V], release_year[2013])","Ah, the Grand Theft Auto V from 2013 is what you mean, correct?"
"confirm(name[Grand Theft Auto V], release_year[2013])","By Grand Theft Auto V you mean the game that came out in 2013, right?"
"confirm(name[Horizon: Zero Dawn], developer[Guerrilla Games])",Do you mean Horizon: Zero Dawn from Guerrilla Games?
"confirm(name[Horizon: Zero Dawn], developer[Guerrilla Games])",Are you referring to the Horizon: Zero Dawn developed by Guerrilla Games?
"confirm(name[Horizon: Zero Dawn], developer[Guerrilla Games])",Is that the game Horizon: Zero Dawn that Guerrilla Games created?
"confirm(name[Horizon: Zero Dawn], esrb[T (for Teen)])","Oh, do you mean the T rated Horizon: Zero Dawn?"
"confirm(name[Horizon: Zero Dawn], esrb[T (for Teen)])","Do you mean Horizon: Zero Dawn, the game that is rated T and is probably not appropriate for our little brothers to play?"
"confirm(name[Horizon: Zero Dawn], esrb[T (for Teen)])",Are you speaking of the Horizon: Zero Dawn that got the T rating from the ESRB?
"confirm(name[Horizon: Zero Dawn], genres[action-adventure, role-playing, shooter])","By Horizon: Zero Dawn, do you mean the action-adventure shooter with role-playing elements?"
"confirm(name[Horizon: Zero Dawn], genres[action-adventure, role-playing, shooter])","Do you mean Horizon: Zero Dawn, the action adventure RPG shooter?"
"confirm(name[Horizon: Zero Dawn], genres[action-adventure, role-playing, shooter])","Are we talking about the action-adventure shooter RPG, Horizon: Zero Dawn?"
"confirm(name[Horizon: Zero Dawn], platforms[PlayStation])",Is this the Horizon: Zero Dawn on the PlayStation?
"confirm(name[Horizon: Zero Dawn], platforms[PlayStation])","Do you mean the PlayStation game, Horizon: Zero Dawn?"
"confirm(name[Horizon: Zero Dawn], platforms[PlayStation])",Do you mean Horizon: Zero Dawn that you can play on PlayStation?
"confirm(name[Horizon: Zero Dawn], release_year[2017])",Are you talking about Horizon: Zero Dawn from 2017?
"confirm(name[Horizon: Zero Dawn], release_year[2017])",Is the Horizon: Zero Dawn you mentioned the one that came out in 2017?
"confirm(name[Horizon: Zero Dawn], release_year[2017])","Are you talking about Horizon: Zero Dawn, the game that came out in 2017?"
"confirm(name[Little Big Adventure], available_on_steam[yes])",Are you referring to the Little Big Adventure that is available on Steam?
"confirm(name[Little Big Adventure], available_on_steam[yes])","Oh, do you mean Little Big Adventure on Steam?"
"confirm(name[Little Big Adventure], available_on_steam[yes])",The same Little Big Adventure up on Steam?
"confirm(name[Little Big Adventure], genres[action-adventure])",Is the Little Big Adventure you're talking about the one that's in the action-adventure genre?
"confirm(name[Little Big Adventure], genres[action-adventure])","It's called Little Big Adventure and it's an action-adventure game, right?"
"confirm(name[Little Big Adventure], genres[action-adventure])","Do you mean Little Big Adventure, the action-adventure game?"
"confirm(name[Little Big Adventure], platforms[PC])",Are you referring to Little Big Adventure that you play on PC?
"confirm(name[Little Big Adventure], platforms[PC])",Are you referring to Little Big Adventure available on PC?
"confirm(name[Little Big Adventure], platforms[PC])","Ah, do you mean the Little Big Adventure that's out on PC?"
"confirm(name[Little Big Adventure], player_perspective[third person])","Do you mean the third person game, Little Big Adventure?"
"confirm(name[Little Big Adventure], player_perspective[third person])",Don't you mean the Little Big Adventure that is a third person game?
"confirm(name[Little Big Adventure], player_perspective[third person])",Do you mean the Little Big Adventure that has a third person perspective?
"confirm(name[Little Big Adventure], release_year[1994])",You mean the Little Big Adventure that dropped in 1994?
"confirm(name[Little Big Adventure], release_year[1994])","By Little Big Adventure, do you mean the one that came out in 1994?"
"confirm(name[Little Big Adventure], release_year[1994])",Do you mean Little Big Adventure from 1994?
"confirm(name[NBA 2K19], developer[Visual Concepts])",Do you mean NBA 2K19 from Visual Concepts?
"confirm(name[NBA 2K19], developer[Visual Concepts])",Is this the NBA 2K19 that was developed by Visual Concepts?
"confirm(name[NBA 2K19], developer[Visual Concepts])",You mean NBA 2K19 from Visual Concepts?
"confirm(name[NBA 2K19], exp_release_date[September 11, 2018])","The NBA 2K19 that will be released on September 11, 2018?"
"confirm(name[NBA 2K19], exp_release_date[September 11, 2018])","You mean the NBA 2K19 slated for release on September 11, 2018, right?"
"confirm(name[NBA 2K19], exp_release_date[September 11, 2018])","You mean the NBA 2K19 slated for release on September 11, 2018, right?"
"confirm(name[NBA 2K19], exp_release_date[September 11, 2018])","Hey, is the NBA 2K19 you mentioned the one that's supposed to come out on September 11, 2018?"
"confirm(name[NBA 2K19], exp_release_date[September 11, 2018])","Are you talking about NBA 2K19 that's coming out September 11, 2018?"
"confirm(name[NBA 2K19], exp_release_date[September 11, 2018])","Do you mean the game launching September 11, 2018, NBA 2K19?"
"confirm(name[NBA 2K19], genres[sport])","Are you talking about the sports game, NBA 2K19?"
"confirm(name[NBA 2K19], genres[sport])",So you're talking about the sports game NBA 2K19?
"confirm(name[NBA 2K19], genres[sport])",Do you mean the NBA 2K19 that is in the sport genre?
"confirm(name[NBA 2K19], platforms[Nintendo Switch])",Oh! So that's NBA 2K19 for the Nintendo Switch?
"confirm(name[NBA 2K19], platforms[Nintendo Switch])","Oh, you mean NBA 2K19 for the Nintendo Switch?"
"confirm(name[NBA 2K19], platforms[Nintendo Switch])",Do you mean the NBA 2K19 for the Nintendo Switch?
"confirm(name[Need for Speed: The Run], developer[Firebrand Games])",Do you mean the Need for Speed: The Run made by Firebrand Games?
"confirm(name[Need for Speed: The Run], developer[Firebrand Games])",Are you talking about Need for Speed: The Run from Firebrand Games?
"confirm(name[Need for Speed: The Run], developer[Firebrand Games])",Is this the Need for Speed: The Run that Firebrand Games released?
"confirm(name[Need for Speed: The Run], has_multiplayer[yes])","Are you talking about Need for Speed: The Run, the multiplayer game?"
"confirm(name[Need for Speed: The Run], has_multiplayer[yes])",Are you talking about the Need for Speed: The Run that has multiplayer?
"confirm(name[Need for Speed: The Run], has_multiplayer[yes])",Is this the Need for Speed: The Run with a multiplayer?
"confirm(name[Need for Speed: The Run], platforms[Nintendo])",Do you mean the Need for Speed: The Run that's for Nintendo?
"confirm(name[Need for Speed: The Run], platforms[Nintendo])",Are you talking about Need for Speed: The Run on Nintendo?
"confirm(name[Need for Speed: The Run], platforms[Nintendo])","You mean the Need for Speed: The Run on Nintendo, correct?"
"confirm(name[Need for Speed: The Run], player_perspective[first person])",Do you mean the first person Need for Speed: The Run?
"confirm(name[Need for Speed: The Run], player_perspective[first person])",Do you mean the first person perspective Need for Speed: The Run?
"confirm(name[Need for Speed: The Run], player_perspective[first person])","Do you mean the first person game, Need for Speed: The Run?"
"confirm(name[Need for Speed: The Run], release_year[2011])","Are you talking about the game from 2011, Need for Speed: The Run?"
"confirm(name[Need for Speed: The Run], release_year[2011])",Are you speaking of the Need for Speed: The Run that came out in 2011?
"confirm(name[Need for Speed: The Run], release_year[2011])","That's the Need for Speed: The Run that came out in 2011, right?"
"confirm(name[Ori and the Blind Forest], developer[Moon Studios])","Oh, you maen Ori and the Blind Forest from Moon Studios?"
"confirm(name[Ori and the Blind Forest], developer[Moon Studios])",Are you referring to the Ori and the Blind Forest that was created by Moon Studios?
"confirm(name[Ori and the Blind Forest], developer[Moon Studios])",Is that Ori and the Blind Forest which was developed by Moon Studios?
"confirm(name[Ori and the Blind Forest], esrb[E (for Everyone)])",Are you talking about the E rated Ori and the Blind Forest?
"confirm(name[Ori and the Blind Forest], esrb[E (for Everyone)])","By Ori and the Blind Forest, do you mean the one with an E rating?"
"confirm(name[Ori and the Blind Forest], esrb[E (for Everyone)])","Are you talking about Ori and the Blind Forest, which was rated E?"
"confirm(name[Ori and the Blind Forest], has_multiplayer[no])",Do you mean the Ori and the Blind Forest without multiplayer?
"confirm(name[Ori and the Blind Forest], has_multiplayer[no])",Is it the Ori and the Blind Forest that you're talking about the one that doesn't have any multiplayer?
"confirm(name[Ori and the Blind Forest], has_multiplayer[no])","Are you talking about Ori and the Blind Forest, which has no multiplayer mode?"
"confirm(name[Ori and the Blind Forest], platforms[Xbox])",Is this the Ori and the Blind Forest that you can play on Xbox?
"confirm(name[Ori and the Blind Forest], platforms[Xbox])",Do you mean Ori and the Blind Forest on the Xbox?
"confirm(name[Ori and the Blind Forest], platforms[Xbox])",Are you talking about Ori and the Blind Forest on Xbox?
"confirm(name[Ori and the Blind Forest], release_year[2015])","When you mentioned Ori and the Blind Forest, are you talking about the 2015 game?"
"confirm(name[Ori and the Blind Forest], release_year[2015])",Do you mean Ori and the Blind Forest from 2015?
"confirm(name[Ori and the Blind Forest], release_year[2015])",Do you mean Ori and the Blind Forest that was released in 2015?
"confirm(name[The Room], available_on_steam[yes])","Are you referring to the game on Steam, The Room?"
"confirm(name[The Room], available_on_steam[yes])",Are you talking about The Room that you can get on Steam?
"confirm(name[The Room], available_on_steam[yes])",Do you mean the Steam game The Room?
"confirm(name[The Room], developer[Fireproof Games])",Do you mean The Room that was made by Fireproof Games?
"confirm(name[The Room], developer[Fireproof Games])",Do you mean The Room from Fireproof Games?
"confirm(name[The Room], developer[Fireproof Games])",Do you mean the Fireproof Games developed version of The Room?
"confirm(name[The Room], genres[indie, point-and-click, puzzle])",Did you mean the indie puzzle-solving point-and-click game The Room?
"confirm(name[The Room], genres[indie, point-and-click, puzzle])","Are you talking about the indie point-and-click puzzle game, The Room?"
"confirm(name[The Room], genres[indie, point-and-click, puzzle])","So when you say The Room, do you mean the indie point-and-click puzzle game?"
"confirm(name[The Room], has_multiplayer[no])",Are you asking about the single-player only The Room?
"confirm(name[The Room], has_multiplayer[no])","Please clarify, do you mean The Room that has no multiplayer?"
"confirm(name[The Room], has_multiplayer[no])","Oh, do you mean the game without multiplayer, The Room?"
"confirm(name[The Room], release_year[2012])","Are you talking about the 2012 game, The Room?"
"confirm(name[The Room], release_year[2012])","When you mention The Room, do you mean the one that came out in 2012?"
"confirm(name[The Room], release_year[2012])",Do you mean the 2012 game The Room?
