mr,ref,score
"name[The Rice Boat], food[Italian], priceRange[moderate], customer rating[3 out of 5], area[city centre], familyFriendly[no], near[Express by Holiday Inn]",In the city centre near the Express by Holiday Inn is an Italian food place called The Rice Boat. It is not kids friendly but has a 3 out of 5 customer rating and a moderate price range.,3
"name[The Rice Boat], food[Italian], priceRange[more than £30], customer rating[high], area[city centre], familyFriendly[no], near[Express by Holiday Inn]",The Rice Boat offers Italian food at more than £30.  It is not children friendly but had high customer ratings.   It can be found near Express by Holiday Inn in the city centre area.,3
"name[The Rice Boat], food[Italian], priceRange[more than £30], customer rating[high], area[riverside], familyFriendly[no], near[Express by Holiday Inn]",The Rice Boat features good but expensive Italian food that is close to the Express by Holiday Inn in the riverside area and is for adults only.,3
"name[The Rice Boat], food[Italian], priceRange[more than £30], customer rating[high], area[riverside], familyFriendly[yes], near[Express by Holiday Inn]","Located just outside the city centre and next to Express by Holiday Inn hotel, this well-rated restaurant, named The Rice Boat is great for families. However, the prices for this restaurant are high.",3
"name[The Rice Boat], food[Italian], priceRange[£20-25], customer rating[high], area[city centre], familyFriendly[no], near[Express by Holiday Inn]","The Rice Boat is located in the city centre area near Express by Holiday Inn. It has Italian food in the £20-25 price range with a high customer rating, but is not kid friendly.",3
"name[The Rice Boat], food[Italian], priceRange[£20-25], customer rating[high], area[riverside], familyFriendly[no], near[Express by Holiday Inn]","The Rice Boat is located near to Express by Holiday Inn, in the riverside area. It serves Italian cuisine and is priced at £20-25. It has a high customer rating but it is not child friendly.",3
"name[The Rice Boat], food[Italian], priceRange[£20-25], customer rating[high], area[riverside], familyFriendly[no], near[Express by Holiday Inn]",An Italian restaurant in the riverside area near Express by Holiday Inn has a high customer rating. It is not kids friendly but its prices range from £20-25. It is called The Rice Boat.,3
"name[The Rice Boat], food[Italian], priceRange[£20-25], customer rating[high], area[riverside], familyFriendly[no], near[Express by Holiday Inn]",The Rice Boat is an Italian restaurant in the riverside area near Express by Holiday Inn. It is not kids friendly but it has a high customer rating and prices range from £20-25.,3
"name[The Rice Boat], food[Italian], priceRange[£20-25], customer rating[high], area[riverside], familyFriendly[yes], near[Express by Holiday Inn]",The Italian restaurant The Rice Boat is located in riverside near the Express by Holiday Inn. It has received a high customer rating as well as being kid friendly. The price range is £20-25.,3
"name[The Rice Boat], food[Italian], priceRange[£20-25], customer rating[high], area[riverside], familyFriendly[yes], near[Express by Holiday Inn]","In riverside near the Express by Holiday Inn is an Italian restaurant called The Rice Boat. Not only is it kid friendly, it has also received a high customer rating.  Price range is £20-25.",3
"name[The Rice Boat], food[Japanese], customer rating[5 out of 5], area[city centre], familyFriendly[yes]",The city centre has a 5 out of 5 Japanese restaurant called The Rice Boat. It is family-friendly as well.,3
"name[The Rice Boat], food[Japanese], customer rating[5 out of 5], area[riverside], familyFriendly[no]",The Rice Boat serves Japanese food in the riverside area. It is highly rated but not family-friendly.,3
"name[The Rice Boat], food[Japanese], customer rating[5 out of 5], area[riverside], familyFriendly[yes]",The Rice Boat on the riverside offers Japanese food and a family friendly atmosphere. The Rice Boat also merits a five star customer rating.,3
"name[The Rice Boat], food[Japanese], customer rating[average], area[riverside], familyFriendly[no]",The Rice Boat by the riverside is not family-friendly but has an average rating and serves Japanese food.,3
"name[The Rice Boat], food[Japanese], customer rating[high], area[riverside], familyFriendly[yes]","Both highly rated and child friendly, The Rice Boat serves Japanese food from a riverside location.",3
"name[The Rice Boat], food[Japanese], customer rating[low], area[riverside], familyFriendly[yes]","The Rice Boat is a family friendly Japanese restaurant located on the riverside, however it has a low customer rating.",3
"name[The Rice Boat], food[Japanese], customer rating[low], area[riverside], familyFriendly[yes]","Japanese food can be found at The Rice Boat on riverside, however even though they are children-friendly, they have a low customer rating.",3
"name[The Rice Boat], food[Japanese], customer rating[low], area[riverside], familyFriendly[yes]","The Rice Boat may have a low customer rating, but they are a family friendly Japanese restaurant located on the riverside.",3
"name[The Rice Boat], food[Japanese], priceRange[cheap], customer rating[5 out of 5], area[city centre], familyFriendly[no], near[Express by Holiday Inn]","Japanese food served at The Rice Boat has a customer rating of 5 out of 5, is cheap but not family-friendly, and is located near the Express by Holiday Inn in the city centre.",3
"name[The Rice Boat], food[Japanese], priceRange[cheap], customer rating[5 out of 5], area[riverside], familyFriendly[no], near[Express by Holiday Inn]",In riverside near the Express by Holiday Inn is a cheap Japanese restaurant called The Rice Boat. It has a rating of 5 out of 5 but is not family-friendly.,3
"name[The Rice Boat], food[Japanese], priceRange[cheap], customer rating[5 out of 5], area[riverside], familyFriendly[no], near[Express by Holiday Inn]","In riverside, near the Express by Holiday Inn is a cheap Japanese restaurant called The Rice Boat that has a rating of 5 out of 5 but is not family-friendly.",3
"name[The Rice Boat], food[Japanese], priceRange[cheap], customer rating[5 out of 5], area[riverside], familyFriendly[no], near[Express by Holiday Inn]",The Rice Boat of Japanese food  with cheap price is located near Express by Holiday Inn by riverside. Their customer rating rating is high but its not family-friendly.,3
"name[The Rice Boat], food[Japanese], priceRange[high], customer rating[3 out of 5], area[city centre], familyFriendly[yes], near[Express by Holiday Inn]",The Rice Boat is a Japanese restaurant near Express by Holiday Inn at city centre. Its price range is high and is rated 3 out of 5 by customer. It is also children friendly.,3
"name[The Rice Boat], food[Japanese], priceRange[high], customer rating[3 out of 5], area[city centre], familyFriendly[yes], near[Express by Holiday Inn]","At City Centre, near Express by Holiday Inn is a Japanese restaurant called The Rice Boat. Its price range is high and is rated 3 out of 5 by customers. It is also children friendly.",3
"name[The Rice Boat], food[Japanese], priceRange[high], customer rating[3 out of 5], area[riverside], familyFriendly[yes], near[Express by Holiday Inn]","The Rice Boat, a Japanese restaurant, is near Express by Holiday Inn in riverside. I hate a high price range but is child friendly and has a customer rating of 3 out of 5.",3
"name[The Rice Boat], food[Japanese], priceRange[less than £20], customer rating[average], area[city centre], familyFriendly[no], near[Express by Holiday Inn]",The Rice Boat is a cheap Japanese venue in the city centre near the Express by Holiday Inn with an average customer rating but are not family-friendly.,3
"name[The Rice Boat], food[Japanese], priceRange[less than £20], customer rating[low], area[city centre], familyFriendly[no], near[Express by Holiday Inn]",The Rice Boat is a Japanese eatery located near the Express by Holiday Inn in the city centre. Their prices are less than £20 but have low customer ratings and are not family-friendly.,3
"name[The Rice Boat], food[Japanese], priceRange[less than £20], customer rating[low], area[city centre], familyFriendly[no], near[Express by Holiday Inn]",The Rice Boat is a Japanese eatery located near the Express by Holiday Inn in the city centre. Their prices are less than £20 but have low customer ratings and are not family-friendly.,3
"name[The Rice Boat], food[Japanese], priceRange[less than £20], customer rating[low], area[city centre], familyFriendly[yes], near[Express by Holiday Inn]",The Rice Boat is a family-friendly Japanese restaurant in city centre that is usually less than £20 but has a low rating. It is near the Express by Holiday Inn.,3
"name[The Rice Boat], food[Japanese], priceRange[less than £20], customer rating[low], area[riverside], familyFriendly[yes], near[Express by Holiday Inn]","The Rice Boat is a Japanese restaurant, family-friendly and cheap since you can have dinner with less than 20£. It's located on the riverside, right next to the Express by Holiday Inn, but its rating is low.",3
"name[The Rice Boat], food[Japanese], priceRange[less than £20], customer rating[low], area[riverside], familyFriendly[yes], near[Express by Holiday Inn]",The family friendly Japanese restaurant called The Rice Boat is located on the riverside near Express by Holiday Inn has low customer ratings as well as low priced food.,3
"name[The Rice Boat], food[Japanese], priceRange[less than £20], customer rating[low], area[riverside], familyFriendly[yes], near[Express by Holiday Inn]",The Rice Boat is a Japanese family friendly restaurant near Express by Holiday Inn located on the riverside has low priced food as well as poor customer rating.,3
"name[The Rice Boat], food[Japanese], priceRange[less than £20], customer rating[low], area[riverside], familyFriendly[yes], near[Express by Holiday Inn]","The Rice Boat, located along the riverside and near the Express by Holiday Inn, is a family-friendly restaurant providing Japanese food. Its rating is pretty low, but it's affordable as you can eat with less than 20£.",3
"name[The Rice Boat], food[Japanese], priceRange[moderate], customer rating[1 out of 5], area[city centre], familyFriendly[no], near[Express by Holiday Inn]",The Rice Boat serves Japanese food near the city center and the Express by Holiday Inn.  It is customer rated 1 out of 5 and is moderately priced but not kid friendly.,3
"name[The Rice Boat], food[Japanese], priceRange[moderate], customer rating[1 out of 5], area[riverside], familyFriendly[no], near[Express by Holiday Inn]",The Rice Boat is Japanese food place in riverside near Express by Holiday Inn. It has a moderate price range and a customer  rating of 1 out of 5. It is also a none kids friendly zone.,3
"name[The Rice Boat], food[Japanese], priceRange[more than £30], customer rating[5 out of 5], area[city centre], familyFriendly[no], near[Express by Holiday Inn]","The Rice Boat is not child friendly and can be costly at more than £30, but it is located in the city centre near Express by Holiday Inn, and it's Japanese food is rated a 5 out of 5 by customers.",3
"name[The Rice Boat], food[Japanese], priceRange[more than £30], customer rating[5 out of 5], area[city centre], familyFriendly[yes], near[Express by Holiday Inn]",The Rice Boat is a child friendly Japanese restaurant near the Express by Holiday Inn in city center that has an excellent customer rating but is in the higher price range.,3
"name[The Rice Boat], food[Japanese], priceRange[more than £30], customer rating[5 out of 5], area[riverside], familyFriendly[no], near[Express by Holiday Inn]","The Rice Boat is located in the riverside area near Express by Holiday Inn. It serves Japanese food and has a customer rating of 5 out of 5.  However, it is not child friendly and costs more than £30.",3
"name[The Rice Boat], food[Japanese], priceRange[more than £30], customer rating[5 out of 5], area[riverside], familyFriendly[no], near[Express by Holiday Inn]","If you're looking for a Japanese restaurant by the riverside, The Rice Boat offers a children-free atmosphere and is located near the Express by Holiday Inn. The prices ranges more than £30, but customers rave about it, rating it a 5 out of 5.",3
"name[The Rice Boat], food[Japanese], priceRange[more than £30], customer rating[5 out of 5], area[riverside], familyFriendly[no], near[Express by Holiday Inn]",Located in the riverside area near Express by Holiday Inn is The Rice Boat. It serves expensive Japanese food but has a 5 out of 5 customer rating. It is not child friendly.,3
"name[The Rice Boat], food[Japanese], priceRange[more than £30], customer rating[5 out of 5], area[riverside], familyFriendly[yes], near[Express by Holiday Inn]",The Rice Boat in riverside is a Japanese restaurant near Express by Holiday Inn.  Child friendly with a customer rating of 5 out of 5 but a price range of more than £30.,3
"name[The Rice Boat], food[Japanese], priceRange[more than £30], customer rating[low], area[city centre], familyFriendly[no], near[Express by Holiday Inn]","A Japanese eating establishment near to the Express by Holiday Inn is The Rice Boat.  They are not children friendly have a low customer rating and their prices range more than £30.  However, they are in the city centre.",3
"name[The Rice Boat], food[Japanese], priceRange[more than £30], customer rating[low], area[city centre], familyFriendly[yes], near[Express by Holiday Inn]","There is a Japanese restaurant called The Rice Boat in the city centre near Express by Holiday Inn. It will cost more than £30 and is children friendly, however it has a low customer rating.",3
"name[The Rice Boat], food[Japanese], priceRange[£20-25], customer rating[high], area[city centre], familyFriendly[no], near[Express by Holiday Inn]","Near Express by Holiday Inn in the city centre is The Rice Boat, which serves Japanese food. It is highly rated with a price range of £20-25 but is not a kid friendly establishment.",3
"name[The Rice Boat], food[Japanese], priceRange[£20-25], customer rating[high], area[riverside], familyFriendly[no], near[Express by Holiday Inn]","The Japanese restaurant The Rice Boat is not kid friendly, but it is highly rated.  It is near the Express by Holiday Inn in the riverside area.  It  has average prices between £20-25.",3
"name[The Rice Boat], food[Japanese], priceRange[£20-25], customer rating[high], area[riverside], familyFriendly[no], near[Express by Holiday Inn]","The Rice Boat is a Japanese restaurant in the riverside area near Express by Holiday Inn. They aren't kid friendly, but they are highly rated with average prices.",3
"name[The Rice Boat], priceRange[high], customer rating[average], near[Rainbow Vegetarian Café]","With an average rating, The Rice Boat is close to the Rainbow Vegetarian Café, but has a high price range.",3
"name[The Rice Boat], priceRange[high], customer rating[average], near[Rainbow Vegetarian Café]","There is a place called The Rice Boat, it's of high price, but average customer rating near the Rainbow Vegetarian Café.",3
"name[The Rice Boat], priceRange[less than £20], customer rating[low], near[Rainbow Vegetarian Café]",Near the Rainbow Vegetarian Café is The Rice Boat. It has a low rating but costs less than £20.,3
"name[The Rice Boat], priceRange[less than £20], customer rating[low], near[Rainbow Vegetarian Café]",The Rice Boat has a low customer rating but the price range is less than £20 and is located near the Rainbow Vegetarian Café.,3
"name[The Rice Boat], priceRange[moderate], customer rating[1 out of 5], near[Rainbow Vegetarian Café]",The Rice Boat is a moderately priced but poorly rated restaurant located near Rainbow Vegetarian Café.,3
"name[The Rice Boat], priceRange[moderate], customer rating[1 out of 5], near[Rainbow Vegetarian Café]","Located near Rainbow Vegetarian Café, The Rice Boat is moderately priced, but received 1 out of 5 stars.",3
"name[The Rice Boat], priceRange[more than £30], customer rating[5 out of 5], near[Rainbow Vegetarian Café]",Near Rainbow Vegetarian Café is The Rice Boat. It has 5 out 5 customer ratings despite it's food being higher than 30 euros.,3
"name[The Rice Boat], priceRange[more than £30], customer rating[5 out of 5], near[Rainbow Vegetarian Café]","The Rice Boat is near the Rainbow Vegetarian Café, it costs more than £30 but it has a 5 out of 5 customer rating.",3
"name[The Rice Boat], priceRange[more than £30], customer rating[5 out of 5], near[Rainbow Vegetarian Café]","Near the Rainbow Vegetarian Café is a restaurant called The Rice Boat, it has a 5 out of 5 customer rating but costs more than £30.",3
"name[The Twenty Two], eatType[pub], customer rating[high], area[riverside], near[Café Sicilia]",Near Café Sicilia is a riverside pub with a high customer rating: The Twenty Two.  The Rice Boat serves fast food in the riverside area.  It is family friendly but has a low customer rating.,3
"name[The Twenty Two], eatType[pub], customer rating[low], area[riverside], near[Café Sicilia]",If you have been down to the riverside you might have seen a place called Café Sicilia. Opposite that there is a pub called The Twenty Two. It overlooks the river and is in a nice setting however the customer rating is quite low.,3
"name[The Twenty Two], eatType[pub], customer rating[low], area[riverside], near[Café Sicilia]","Down by the riverside there is a pub called The Twenty Two, just next to Café Sicilia, but the customer rating is quite low.",3
"name[The Twenty Two], eatType[pub], customer rating[low], area[riverside], near[Café Sicilia]",Next to Café Sicilia down by the riverside is The Twenty Two Pub but I don't recommend eating there.,3
"name[The Twenty Two], food[Chinese], area[city centre], familyFriendly[no]",The Twenty Two is in centre city and serves Chinese food but is not family friendly.,3
"name[The Twenty Two], food[Chinese], area[city centre], familyFriendly[no]",The Twenty Two is not family friendly but offers Chinese food in centre city.,3
"name[The Twenty Two], food[Chinese], area[city centre], familyFriendly[no]","The Twenty Two is not family friendly, but it dishes out Chinese food in the city center.",3
"name[The Twenty Two], food[Chinese], area[riverside], familyFriendly[no]",The Twenty Two serves Chinese food in the Riverside but is not family friendly.,3
"name[The Twenty Two], food[Chinese], familyFriendly[yes]",The Twenty Two is a delicious Chinese restaurant and great for kids too.,3
"name[The Twenty Two], food[English], area[riverside], familyFriendly[yes]",The Twenty Two is a family friendly restaurant that serves English food. It is also family friendly.,3
"name[The Twenty Two], food[English], area[riverside], familyFriendly[yes]","The Twenty Two is on the riverside, and serves English food. It is also family-friendly.",3
"name[The Twenty Two], food[English], familyFriendly[no]","There is place that serves English food called The Twenty Two, but it is not family-friendly.",3
"name[The Twenty Two], food[English], familyFriendly[yes]",If you are looking for English food then you could try The Twenty Two. It is also family friendly.,3
"name[The Twenty Two], food[Fast food], area[riverside], familyFriendly[no]","The Twenty Two is a fast food restaurant located near the river. However, bear in mind that the restaurant is not family appropriate.",3
"name[The Twenty Two], food[Fast food], familyFriendly[yes]",The Twenty Two serves fast-food. It is also child-friendly.,3
"name[The Twenty Two], food[French], area[city centre], familyFriendly[no]",The Twenty Two is located in the city centre. It serves French food but is not family-friendly.,3
"name[The Twenty Two], food[French], familyFriendly[yes]",For French cuisine try The Twenty Two. It is also kid friendly.,3
"name[The Twenty Two], food[Italian], area[riverside], familyFriendly[yes]","For Italian food, try The Twenty Two in Riverside which is also suitable for children.",3
"name[The Twenty Two], food[Italian], area[riverside], familyFriendly[yes]","A great restaurant located in the Riverside area is The Twenty Two. It is children-friendly, so feel free to bring your kids as well.",3
"name[The Twenty Two], food[Italian], familyFriendly[yes]","Child friendly restaurant, The Twenty Two, provides Italian meals also.",3
"name[The Twenty Two], food[Italian], familyFriendly[yes]","An Italian eatery, The Twenty Two also is kid friendly.",3
"name[The Twenty Two], food[Japanese], area[city centre], familyFriendly[no]",There is a restaurant named The Twenty Two Located in city center serving Japanese Food but not family-friendly.,3
"name[The Twenty Two], food[Japanese], area[riverside], familyFriendly[yes]","The Twenty Two is located by the riverside, it serves Japanese food and also very family-Friendly.",3
"name[The Twenty Two], priceRange[cheap], customer rating[5 out of 5], area[riverside], familyFriendly[no], near[The Rice Boat]","The Twenty Two close to The Rice Boat is cheap in price and has an excellent customer review of 5 out of 5, it is also close to the riverside area but do not cater for children.",6
"name[The Twenty Two], priceRange[high], customer rating[1 out of 5], area[riverside], familyFriendly[yes], near[The Rice Boat]","The Twenty Two near The Rice Boat by the Riverside is high-priced and low rated by customers, but it is child-friendly.",3
"name[The Twenty Two], priceRange[high], customer rating[average], area[riverside], familyFriendly[yes], near[The Rice Boat]",The Twenty Two has an average rating. Its price range is high but it is children friendly. It is near The Rice Boat by the riverside.,3
"name[The Twenty Two], priceRange[high], customer rating[average], area[riverside], familyFriendly[yes], near[The Rice Boat]","The Twenty Two in riverside, located near The Rice Boat, is children friendly and has good customer ratings. The prices are a little more than average but the friendly atmosphere and good serves is worth it.",3
"name[The Twenty Two], priceRange[less than £20], customer rating[average], area[city centre], familyFriendly[no], near[The Rice Boat]","The city centre is home of The Twenty Two near The Rice Boat. It has an average customer rating and a price range of less than 20 pounds, but is not family-friendly.",3
"name[The Twenty Two], priceRange[less than £20], customer rating[average], area[city centre], familyFriendly[no], near[The Rice Boat]","For a cheap restaurant in the city centre, try The Twenty Two.  It is near The Rice Boat and food costs less than £20.  However, it is not family-friendly.",3
"name[The Twenty Two], priceRange[less than £20], customer rating[average], area[city centre], familyFriendly[yes], near[The Rice Boat]","In the city centre, near to The Rice Boat is located The Twenty Two and offers family area. It has a price range less than £20  but with an average customer rating.",3
"name[The Twenty Two], priceRange[less than £20], customer rating[average], area[city centre], familyFriendly[yes], near[The Rice Boat]","The Twenty Two and offers family area.  It has a price range less than £20  but with an average customer rating.  It is located in the city centre, near to The Rice Boat.",3
"name[The Twenty Two], priceRange[less than £20], customer rating[average], area[riverside], familyFriendly[no], near[The Rice Boat]","There is a place  named The Twenty Two which is located at riverside near The Rice Boat that has an average customer rating, a price less than 20, but is not family-friendly.",3
"name[The Twenty Two], priceRange[less than £20], customer rating[average], area[riverside], familyFriendly[yes], near[The Rice Boat]",The Twenty Two is a low-priced venue that is family friendly. You can also get on The Rice Boat here.,3
"name[The Twenty Two], priceRange[less than £20], customer rating[low], area[city centre], familyFriendly[no], near[The Rice Boat]","The Twenty Two is located near The Rice Boat in the city center, it is non family-friendly with a low customer rating, but there price ranges are less than £20.",3
"name[The Twenty Two], priceRange[less than £20], customer rating[low], area[city centre], familyFriendly[yes], near[The Rice Boat]",There is a family-friendly restaurant named The Twenty Two it is family-friendly with low prices it is located near The Rice Boat in city centre but it is rated low.,3
"name[The Twenty Two], priceRange[less than £20], customer rating[low], area[riverside], familyFriendly[no], near[The Rice Boat]",The one star The Twenty Two is near The Rice Boat. It is cheap but not family friendly.,3
"name[The Twenty Two], priceRange[less than £20], customer rating[low], area[riverside], familyFriendly[no], near[The Rice Boat]","Near The Rice Boat in riverside is The Twenty Two.  It has low customer ratings, as well as cheap food and is not family-friendly.",3
"name[The Twenty Two], priceRange[less than £20], customer rating[low], area[riverside], familyFriendly[yes], near[The Rice Boat]","The family friendly restaurant near The Rice Boat in the riverside area is called The Twenty Two, but it has low customer rating. The price range is less than 20 pounds.",3
"name[The Twenty Two], priceRange[less than £20], customer rating[low], area[riverside], familyFriendly[yes], near[The Rice Boat]","The Twenty Two is a family friendly restaurant in the riverside area near The Rice Boat. The price range is less than 20 pounds, but has a low customer rating.",3
"name[The Twenty Two], priceRange[less than £20], customer rating[low], area[riverside], familyFriendly[yes], near[The Rice Boat]","On the riverside, near The Rice Boat is The Twenty Two. Yes, it is family friendly, price range is less than  £20, but it has a low customer rating.",3
