mr,ref,score
"name[The Eagle], eatType[coffee shop], food[Japanese], priceRange[high], customer rating[3 out of 5], area[city centre], familyFriendly[no], near[Burger King]",The Eagle is a coffee shop serving Japanese food found in the city centre close to Burger King. It is quite expensive but it does have good reviews. Families are not welcome.,3
"name[The Eagle], eatType[coffee shop], food[Japanese], priceRange[high], customer rating[3 out of 5], area[city centre], familyFriendly[no], near[Burger King]",The Eagle is an adults-only coffee shop serving Japanese food. It has good reviews however it is quite expensive. It is located near Burger King in the city centre.,3
"name[The Eagle], eatType[coffee shop], food[Japanese], priceRange[high], customer rating[3 out of 5], area[city centre], familyFriendly[yes], near[Burger King]",There is a kids friendly coffee shop The Eagle in the city centre near Burger King. It has high customer ratings and high price range but they serve Japanese food.,3
"name[The Eagle], eatType[coffee shop], food[Japanese], priceRange[high], customer rating[3 out of 5], area[riverside], familyFriendly[no], near[Burger King]",The Eagle is a high priced coffee shop in the riverside area near Burger King. It serves Japanese food and is not child friendly but has a customer rating of 3 out of 5.,3
"name[The Eagle], eatType[coffee shop], food[Japanese], priceRange[high], customer rating[3 out of 5], area[riverside], familyFriendly[yes], near[Burger King]","The Burger King by the riverside is kid friendly, but is rated 3 out of 5. There is also a coffee shop that offers Japanese food, but it is a bit expensive. It is called The Eagle.",6
"name[The Eagle], eatType[coffee shop], food[Japanese], priceRange[less than £20], customer rating[average], area[city centre], familyFriendly[no], near[Burger King]",The Eagle coffee shop that is less than 20 pounds and has an average customer rating and is family-friendly.  They serve Japanese food near the center of the city and also near the Burger King.,3
"name[The Eagle], eatType[coffee shop], food[Japanese], priceRange[less than £20], customer rating[average], area[riverside], familyFriendly[no], near[Burger King]","The Eagle is located in riverside, near Burger King.  it is a coffee shop which sells Japanese food for less than £20.  it is rated average by customers but isn't family-friendly.",3
"name[The Eagle], eatType[coffee shop], food[Japanese], priceRange[less than £20], customer rating[average], area[riverside], familyFriendly[no], near[Burger King]","The Eagle is located in riverside, near Burger King.  it is a coffee shop which sells Japanese food for less than £20.  it is rated average by customers but isn't family-friendly.",3
"name[The Eagle], eatType[coffee shop], food[Japanese], priceRange[less than £20], customer rating[average], area[riverside], familyFriendly[yes], near[Burger King]","The Eagle is a riverside coffee shop, situated near Burger King. It has a price range of less than £20 and serves Japanese food. Yes, it is also family friendly. The customer rating is average.",3
"name[The Eagle], eatType[coffee shop], food[Japanese], priceRange[less than £20], customer rating[low], area[riverside], familyFriendly[no], near[Burger King]","The Eagle is a Japanese coffee shop near Burger King in the riverside area. It has a price range of less than 20 pounds and a low customer rating, but it is family-friendly.",3
"name[The Eagle], eatType[coffee shop], food[Japanese], priceRange[less than £20], customer rating[low], area[riverside], familyFriendly[no], near[Burger King]",There is a Japanese coffee shop called The Eagle located near Burger King in the riverside area. It has a price range of less than 20 pounds and a low customer rating. It is also family-friendly.,3
"name[The Eagle], eatType[coffee shop], food[Japanese], priceRange[less than £20], customer rating[low], area[riverside], familyFriendly[no], near[Burger King]","For cheap Japanese food in the town centre, The Eagle is a coffee shop close to Burger King but not family friendly.  It is cheap and has 1 out of 5 stars.",3
"name[The Eagle], eatType[coffee shop], food[Japanese], priceRange[less than £20], customer rating[low], area[riverside], familyFriendly[yes], near[Burger King]",The Eagle is a Japanese coffee shop offering food with price range less than £20  for family and is located along riverside near Burger King but has low customer rating.,3
"name[The Eagle], eatType[coffee shop], food[Japanese], priceRange[less than £20], customer rating[low], area[riverside], familyFriendly[yes], near[Burger King]","Over by the Burger King on riverside is The Eagle coffee shop. Fairly low rated, but family friendly, and providing Japanese for below £20.",3
"name[The Eagle], eatType[coffee shop], food[Japanese], priceRange[more than £30], customer rating[5 out of 5], area[city centre], familyFriendly[no], near[Burger King]","A high priced Japanese coffee shop with a high customer rating but not child friendly, is The Eagle, near Burger King in the city centre.",3
"name[The Eagle], eatType[coffee shop], food[Japanese], priceRange[more than £30], customer rating[5 out of 5], area[city centre], familyFriendly[no], near[Burger King]",Near Burger King in the city centre there is a coffee shop serving Japanese food called The Eagle. It costs more than £30 but has a customer rating of 5 out of 5. This establishment is not child friendly.,3
"name[The Eagle], eatType[coffee shop], food[Japanese], priceRange[more than £30], customer rating[5 out of 5], area[city centre], familyFriendly[no], near[Burger King]","The Eagle is a high priced Japanese coffee shop near Burger King in the city centre  with a high customer rating, but not child friendly.",3
"name[The Eagle], eatType[coffee shop], food[Japanese], priceRange[more than £30], customer rating[5 out of 5], area[city centre], familyFriendly[yes], near[Burger King]","The Eagle is a children-friendly coffee shop, it is located near Burger King in the city centre that also serves Japanese food with a price range for more than £30 with a rating of 5 out of 5.",3
"name[The Eagle], eatType[coffee shop], food[Japanese], priceRange[more than £30], customer rating[5 out of 5], area[riverside], familyFriendly[no], near[Burger King]",The Eagle serving Japanese cuisine in its coffee shop does not cater for children. It is situated close to Burger King near riverside. It has a price list of more than £30 but has a customer review of 5 out of 5.,3
"name[The Eagle], eatType[coffee shop], food[Japanese], priceRange[more than £30], customer rating[low], area[city centre], familyFriendly[yes], near[Burger King]","yes it loves to have children. serving Japanese food, called The Eagle, although has a low customer review, situated close to Burger King near the city centre is a coffee shop but quite expensive at more than £30,.",3
"name[The Eagle], eatType[coffee shop], food[Japanese], priceRange[more than £30], customer rating[low], area[city centre], familyFriendly[yes], near[Burger King]","The Eagle is a family-friendly, Japanese, coffee shop located in the city centre near the Burger King. However, it has a low customer rating and the meals cost more than 30 pounds.",3
"name[The Eagle], eatType[coffee shop], food[Japanese], priceRange[more than £30], customer rating[low], area[city centre], familyFriendly[yes], near[Burger King]",The Eagle Japanese coffee shop near Burger King in the city centre welcomes children but is costly at more than £30 and has a low customer review.,3
"name[The Eagle], eatType[coffee shop], food[Japanese], priceRange[more than £30], customer rating[low], area[city centre], familyFriendly[yes], near[Burger King]","There is a Japanese coffee shop called The Eagle, near the city centre Burger King. It is family-friendly but has a low customer rating and costs more than 30 pounds.",3
"name[The Eagle], eatType[coffee shop], food[Japanese], priceRange[£20-25], customer rating[3 out of 5], area[city centre], familyFriendly[no], near[Burger King]",The Eagle coffee shop serves Japanese food in the £20 - £25 price range but is not child friendly and has a customer rating of 3 out of 5 and is located near Burger King in the city centre.,3
"name[The Eagle], eatType[coffee shop], food[Japanese], priceRange[£20-25], customer rating[3 out of 5], area[city centre], familyFriendly[no], near[Burger King]",The Eagle coffee shop serves Japanese food in the £20 - £25 price range but is not child friendly and has a customer rating of 3 out of 5 and is located near Burger King in the city centre.,3
"name[The Eagle], eatType[coffee shop], food[Japanese], priceRange[£20-25], customer rating[3 out of 5], area[riverside], familyFriendly[no], near[Burger King]","Riverside coffee shop near Burger King, The Eagle, offers Japanese food  and has a 3 out of 5 rating. It is not kid-friendly, but average price.",3
"name[The Eagle], eatType[coffee shop], food[Japanese], priceRange[£20-25], customer rating[3 out of 5], area[riverside], familyFriendly[no], near[Burger King]",There is a coffee shop near Burger King in the riverside. Its name is The Eagle. It provides Japanese food. The price range and its rating is average but it isn't family-friendly.,3
"name[The Eagle], eatType[coffee shop], food[Japanese], priceRange[£20-25], customer rating[high], area[city centre], familyFriendly[yes], near[Burger King]","The Eagle, is a Japanese restaurant, is also a coffee shop, this is a good place for kids,and is near Burger King, the price is not that bad and is located in the city center.",3
"name[The Eagle], eatType[coffee shop], food[Japanese], priceRange[£20-25], customer rating[high], area[riverside], familyFriendly[no], near[Burger King]","There's a coffee shop that serves Japanese food at Riverside called The Eagle. It's near Burger King. The price range is about £20-25 and it's not kids-friendly, but the customer Rating is high.",3
"name[The Eagle], eatType[coffee shop], food[Japanese], priceRange[£20-25], customer rating[high], area[riverside], familyFriendly[no], near[Burger King]","Located riverside near Burger King, The Eagle is a coffee shop offering Japanese food with a price range of £20-25. Not children friendly, but it has a high customer rating.",3
"name[The Eagle], eatType[coffee shop], food[Japanese], priceRange[£20-25], customer rating[high], area[riverside], familyFriendly[yes], near[Burger King]",There is a Japanese coffee shop called The Eagle its by the riverside near Burger King with high ratings and also kid friendly.,3
"name[The Eagle], food[Fast food], customer rating[1 out of 5]","customer rating is poor 1 out of 5, but The Eagle is quality food.",3
"name[The Eagle], food[Fast food], customer rating[low]","The Eagle offers fast food, but has low customer ratings.",3
"name[The Eagle], food[French], customer rating[5 out of 5]","Down Glisson Road lies The Eagle, a restaurant known by many as a fine winery that also offers cheese and fondue samples to match the wine they provide, and today they are celebrating the summer solstice.",3
"name[The Eagle], food[French], customer rating[low]",The Eagle serves French food but has a low customer rating.,3
"name[The Eagle], food[Indian], customer rating[5 out of 5]","The Eagle provides a 5 out of five rating on Indian food, but the rest of their food is sub par.",3
"name[The Eagle], food[Indian], customer rating[low]",There is an Indian restaurant called The Eagle but it has a low customer rating.,3
"name[The Eagle], food[Indian], customer rating[low]",n The Eagle there are a Chinese shop high average enter riverside and stop no but Express by Holiday Inn.,3
"name[The Eagle], food[Italian], customer rating[5 out of 5]","The Eagle in Cambridge has five-star reviews for its food, and it's licensed as well.",3
"name[The Eagle], food[Italian], customer rating[5 out of 5]","For five-star reviewed food, try The Eagle in Cambridge. It is a licensed restaurant, so you can enjoy a drink, too.",3
"name[The Eagle], food[Italian], customer rating[low]",The Eagle is a cheap restaurant serving Italian food however it's low ratings make buyers less likely to visit.,3
"name[The Eagle], food[Japanese], customer rating[1 out of 5]","The Eagle is a Japanese restaurant, however is low customer rated.",3
"name[The Eagle], priceRange[cheap], customer rating[5 out of 5], area[riverside]",Located on the riverside is The Eagle.  It's known for having a cheap price range but a wonderful customer rating of 5 out of 5.,3
"name[The Eagle], priceRange[cheap], customer rating[average], area[riverside]","In Riverside, The Eagle has been given an average customer rating, it is however, cheap.",3
"name[The Eagle], priceRange[high], customer rating[1 out of 5], area[riverside]",The Eagle can be located by the river higher price range but poor customer rating.,3
"name[The Eagle], priceRange[less than £20], customer rating[low], area[city centre]","The Eagle in the city centre has a lower than average price. Customer rating is low, however.",3
"name[The Eagle], priceRange[moderate], customer rating[1 out of 5], area[riverside]","A restaurant called The Eagle is located in the area of riverside. It had a moderate price range, but  it has a low customer rating of 1 out of 5.",3
"name[The Eagle], priceRange[more than £30], customer rating[5 out of 5], area[riverside]",Near the river is The Eagle. It is expensive but has 5 stars.,3
"name[The Eagle], priceRange[more than £30], customer rating[5 out of 5], area[riverside]",The Eagle offers a calming yet classy environment with is five star rating and location on the river.,3
"name[The Eagle], priceRange[more than £30], customer rating[5 out of 5], area[riverside]",The Eagle is located in the area of Riverside. The price range can be quite expensive at £30.00 or more however the customer rating  is 5 out of 5.,3
"name[The Eagle], priceRange[more than £30], customer rating[high], area[riverside]",The Eagle is a good place to come and eat the best food looking the riverside more than £30 but a good choice.,3
"name[The Eagle], priceRange[more than £30], customer rating[high], area[riverside]",The Eagle is a good place to come and eat the best food looking the riverside more than £30 but a good choice.,3
"name[The Eagle], priceRange[£20-25], customer rating[high], area[city centre]","The Eagle is located at the city centre. It is high priced, but boasts a high customer approval rating.",3
"name[The Golden Curry], familyFriendly[no], near[The Six Bells]",The Golden Curry is not family-friendly but is located near The Six Bells.,3
"name[The Golden Curry], familyFriendly[yes], near[The Six Bells]",The Golden Curry is located near The Six Bells. It is also kid friendly.,3
"name[The Golden Curry], food[Chinese], customer rating[1 out of 5], area[riverside], familyFriendly[yes], near[Café Rouge]",The Golden Curry is a Chinese restaurant that's rated 1 out of 5; but is riverside and family friendly located near Café Rouge.,3
"name[The Golden Curry], food[Chinese], customer rating[5 out of 5], area[city centre], familyFriendly[no], near[Café Rouge]","The Golden Curry, a Chinese restaurant rated five out of five by customers is located near Café Rouge, in the city centre. However, it is not family friendly.",3
"name[The Golden Curry], food[Chinese], customer rating[5 out of 5], area[city centre], familyFriendly[no], near[Café Rouge]","The Golden Curry is a Chinese restaurant with a fantastic customer rating of five out of five. It's in the city centre near Café Rouge, but is not family friendly.",3
"name[The Golden Curry], food[Chinese], customer rating[5 out of 5], area[city centre], familyFriendly[no], near[Café Rouge]","In the center. of the city, near Café Rouge, there is a restaurant called The Golden Curry, serving Chinese food. It is rated five out of five by customers, but is not family friendly.",3
"name[The Golden Curry], food[Chinese], customer rating[5 out of 5], familyFriendly[no]","The Golden Curry is an establishment serving Chinese cuisine which he's earned it a 5 out if 5 customer rating, but it is not a family oriented restaurant.",3
"name[The Golden Curry], food[Chinese], customer rating[average], area[city centre], familyFriendly[no], near[Café Rouge]",The Golden Curry serves Chinese food and is by Café Rouge. It has an average customer rating and is also not family friendly.,3
"name[The Golden Curry], food[Chinese], customer rating[average], area[riverside], familyFriendly[yes], near[Café Rouge]","The Golden Curry restaurant's Chinese food is rated average by customers, but is nestled in the area near the riverside, it is children friendly and it is located by Café Rouge.",3
"name[The Golden Curry], food[Chinese], customer rating[average], familyFriendly[no]","There's an average Chinese restaurant, The Golden Curry, but it doesn't allow children.",3
"name[The Golden Curry], food[Chinese], customer rating[high], area[riverside], familyFriendly[yes], near[Café Rouge]","The Golden Curry is a both highly rated and kid friendly Chinese restaurant on the river, near Café Rouge.",3
"name[The Golden Curry], food[Chinese], customer rating[low], area[city centre], familyFriendly[yes], near[Café Rouge]","The Golden Curry is a Chinese place with a low customer rating near Café Rouge in the cite centre, it is also family friendly.",3
"name[The Golden Curry], food[Chinese], customer rating[low], familyFriendly[yes]",A Chinese food that is family friendly but has low customer ratings is called The Golden Curry.,3
"name[The Golden Curry], food[Chinese], priceRange[high], familyFriendly[no], near[The Bakers]","The Golden Curry, located near The Bakers provides Chinese food at a price range of high. It is not child friendly, however.",3
"name[The Golden Curry], food[Chinese], priceRange[more than £30], familyFriendly[yes], near[The Bakers]",The Golden Curry Chinese restaurant is a bit pricey but kid friendly. It serves chines food and is located near The Bakers.,3
"name[The Golden Curry], food[Chinese], priceRange[more than £30], familyFriendly[yes], near[The Bakers]","Located near The Bakers, The Golden Curry Chinese restaurant is child friendly but be prepared to pay more than 30 British pounds.",3
"name[The Golden Curry], food[English], customer rating[1 out of 5], area[riverside], familyFriendly[yes], near[Café Rouge]","The Golden Curry  serves English dishes, and is child friendly. It is in the riverside district near Café Rouge, but it has a 1 out of 5 star rating.",3
"name[The Golden Curry], food[English], customer rating[1 out of 5], area[riverside], familyFriendly[yes], near[Café Rouge]",The English restaurant located near Café Rouge on the river is called The Golden Curry. It has a low rating but is child friendly.,3
"name[The Golden Curry], food[English], customer rating[1 out of 5], area[riverside], familyFriendly[yes], near[Café Rouge]","The Golden Curry serves English food by the river, near Café Rouge. It is child friendly but has a 1 out of 5 rating.",3
"name[The Golden Curry], food[English], customer rating[1 out of 5], area[riverside], familyFriendly[yes], near[Café Rouge]","The Golden Curry  serves English dishes, and is child friendly. It is in the riverside district near Café Rouge, but it has a 1 out of 5 star rating.",3
"name[The Golden Curry], food[English], customer rating[3 out of 5], familyFriendly[yes]","Both kid friendly and average, The Golden Curry is an English restaurant.",3
"name[The Golden Curry], food[English], customer rating[5 out of 5], area[city centre], familyFriendly[no], near[Café Rouge]",The Golden Curry has English food and is located in the city centre not far from the Café Rouge. Not recommended for families but has a 5 out of 5 rating.,3
"name[The Golden Curry], food[English], customer rating[5 out of 5], area[city centre], familyFriendly[no], near[Café Rouge]",The Golden Curry is an English restaurant located in the city centre near Café Rouge. It has a high customer rating but is not family-friendly.,3
"name[The Golden Curry], food[English], customer rating[5 out of 5], area[riverside], familyFriendly[no], near[Café Rouge]","Near Café Rouge is a place called The Golden Curry. It is riverside and has a 5 out of 5 rating, but it is not family-friendly.",3
"name[The Golden Curry], food[English], customer rating[5 out of 5], familyFriendly[no]","The Golden Curry does not serve families, but they are a 5 out of 5 restaurant that serves English.",3
"name[The Golden Curry], food[English], customer rating[average], area[riverside], familyFriendly[no], near[Café Rouge]","The Golden Curry for English food in riverside area, near Café Rouge,  but its customer rating is average and also is not family-friendly.",6
"name[The Golden Curry], food[English], customer rating[average], area[riverside], familyFriendly[no], near[Café Rouge]","Located in the riverside area, close to Café Rouge, The Golden Curry is an English restaurant with an average customer rating but it is not family-friendly.",3
"name[The Golden Curry], food[English], customer rating[average], familyFriendly[no]","The Golden Curry does not cater for families but provide a variety of foods, including English and has been rated to be average.",3
"name[The Golden Curry], food[English], customer rating[high], familyFriendly[yes]",The Golden Curry is not only child friendly and English but also has high ratings from their customers.,6
"name[The Golden Curry], food[English], customer rating[low], area[city centre], familyFriendly[no], near[Café Rouge]","The Golden Curry isn't family-friendly, or highly rated by customers, however it's English food, and right in the center of the city near, Café Rouge.",3
"name[The Golden Curry], food[English], customer rating[low], area[city centre], familyFriendly[no], near[Café Rouge]","The Golden Curry is a non friendly, English serving restaurant. It has a low rating, but is located in the center of the city near Café Rouge.",3
"name[The Golden Curry], food[English], customer rating[low], area[city centre], familyFriendly[no], near[Café Rouge]","The Golden Curry is located in the city centre near Café Rouge, serving English food, but has a low customer rating, and is not family-friendly.",3
"name[The Golden Curry], food[English], customer rating[low], area[city centre], familyFriendly[yes], near[Café Rouge]","The Golden Curry serves English food and is family-friendly, and conveniently located in the center of town near the Café Rouge, but it has a low customer rating.",3
"name[The Golden Curry], food[English], customer rating[low], area[city centre], familyFriendly[yes], near[Café Rouge]","The Golden Curry has a low customer rating, but is family-friendly, serves English food, and is conveniently located near the Café Rouge in the city center.",3
"name[The Golden Curry], food[English], customer rating[low], area[riverside], familyFriendly[no], near[Café Rouge]","The Golden Curry is a non-family-friendly venue that serves English food. It is located near Café Rouge in the riverside area. However, it has a low customer rating.",3
"name[The Golden Curry], food[English], customer rating[low], familyFriendly[yes]",There is a dine in family restaurant called The Golden Curry but it has terrible reviews.,3
"name[The Golden Curry], food[English], customer rating[low], familyFriendly[yes]",The Golden Curry is a dine in restaurant that accommodates families but has terrible reviews.,3
"name[The Golden Curry], food[English], priceRange[cheap], familyFriendly[yes], near[The Bakers]","cheap English food can be found at The Golden Curry near to The Bakers, and they are also family friendly.",3
"name[The Golden Curry], food[English], priceRange[less than £20], familyFriendly[no], near[The Bakers]","The Golden Curry near The Bakers serves English food for less than £20, but it is not family-friendly.",3
"name[The Golden Curry], food[English], priceRange[less than £20], familyFriendly[yes], near[The Bakers]",The Golden Curry is located near to The Bakers and it is providing English food in price less than £20 . Also it is friendly for family.,3
"name[The Golden Curry], food[Fast food], customer rating[1 out of 5], area[riverside], familyFriendly[yes], near[Café Rouge]","Based on the riverside near Café Rouge, The Golden Curry fast food restaurant is low rated but child friendly.",3
"name[The Golden Curry], food[Fast food], customer rating[1 out of 5], area[riverside], familyFriendly[yes], near[Café Rouge]","The Golden Curry fast food restaurant is child friendly but has a low customer rating. It can be found on the riverside, near Café Rouge.",3
"name[The Golden Curry], food[Fast food], customer rating[3 out of 5], familyFriendly[yes]",The Golden Curry is a fast good restaurant that is kid friendly but it has a rating of 3 out of 5.,3
"name[The Golden Curry], food[Fast food], customer rating[5 out of 5], area[riverside], familyFriendly[no], near[Café Rouge]","The Golden Curry serves fast food in the Riverside area near Café Rouge.  It features an excellent customer rating, but is not family-friendly.",3
"name[The Golden Curry], food[Fast food], customer rating[5 out of 5], familyFriendly[no]",The Golden Curry is not child friendly but has a 5 out of 5 customer rating and serves fast food.,3
"name[The Golden Curry], food[Fast food], customer rating[5 out of 5], familyFriendly[yes]",The Golden Curry serves fast and is considered family friendly and  they also has a customer rating of 5 out of 5.,3
"name[The Golden Curry], food[Fast food], customer rating[average], area[city centre], familyFriendly[no], near[Café Rouge]","You can find The Golden Curry at the centre of the city, near Café Rouge. They serve Fast food, but the atmosphere is not family-friendly. Customers give it an average rating.",3
